,tweet_id,timestamp,source,text,rating_numerator,rating_denominator,name,dog_stage,favorite_count,retweet_count,real_rating,class,dog,conf,conf_type,img_num
458,801538201127157760,2016-11-23 21:29:33,"<a href=""http://twitter.com/download/iphone"" rel=""nofollow"">Twitter for iPhone</a>",This is Wallace. He'll be your chau-fur this evening. 12/10 eyes on the road Wallace https://t.co/p1RD39XjUe,12,10,Wallace,None,8989,2337,1.2,shetland_sheepdog,True,0.054229999999999993,p3,1
459,801285448605831168,2016-11-23 04:45:12,"<a href=""http://twitter.com/download/iphone"" rel=""nofollow"">Twitter for iPhone</a>",oh h*ck 10/10 https://t.co/bC69RrW559,10,10,None,None,6664,941,1.0,convertible,False,0.0645338,p3,1
460,801167903437357056,2016-11-22 20:58:07,"<a href=""http://twitter.com/download/iphone"" rel=""nofollow"">Twitter for iPhone</a>",This is Milo. I would do terrible things for Milo. 13/10 https://t.co/R6wJyC2Tey,13,10,Milo,None,26953,6775,1.3,english_setter,True,0.0413314,p3,1
461,801115127852503040,2016-11-22 17:28:25,"<a href=""http://twitter.com/download/iphone"" rel=""nofollow"">Twitter for iPhone</a>",This is Bones. He's being haunted by another doggo of roughly the same size. 12/10 deep breaths pupper everything's fine https://t.co/55Dqe0SJNj,12,10,Bones,doggo,8864,2367,1.2,bluetick,True,0.0219534,p3,1
462,800751577355128832,2016-11-21 17:23:47,"<a href=""http://twitter.com/download/iphone"" rel=""nofollow"">Twitter for iPhone</a>",Say hello to Mauve and Murphy. They're rather h*ckin filthy. Preferred nap over bath. Both 12/10 https://t.co/4UwCTW3lXG,12,10,Mauve,None,11530,3146,1.2,toy_poodle,True,0.0396183,p3,2
463,800513324630806528,2016-11-21 01:37:04,"<a href=""http://twitter.com/download/iphone"" rel=""nofollow"">Twitter for iPhone</a>",This is Chef. Chef loves everyone and wants everyone to love each other. 11/10 https://t.co/ILHGs0e6Dm,11,10,Chef,None,14439,3421,1.1,chihuahua,True,0.0007659339999999999,p3,1
464,800459316964663297,2016-11-20 22:02:27,"<a href=""http://twitter.com/download/iphone"" rel=""nofollow"">Twitter for iPhone</a>",Here's a very sleepy pupper. Appears to be portable as h*ck. 12/10 would snug intensely https://t.co/61sX7pW5Ca,12,10,None,pupper,10375,2435,1.2,christmas_stocking,False,0.173229,p3,1
465,800443802682937345,2016-11-20 21:00:48,"<a href=""http://twitter.com/download/iphone"" rel=""nofollow"">Twitter for iPhone</a>",RT @dog_rates: This is Sampson. He's about to get hit with a vicious draw 2. Has no idea. 11/10 poor pupper https://t.co/FYT9QBEnKG,11,10,Sampson,pupper,0,4920,1.1,paddlewheel,False,0.0174919,p3,1
466,800388270626521089,2016-11-20 17:20:08,"<a href=""http://twitter.com/download/iphone"" rel=""nofollow"">Twitter for iPhone</a>",This is Doc. He takes time out of every day to worship our plant overlords. 12/10 quite the floofer https://t.co/azMneS6Ly5,12,10,Doc,floofer,12251,3181,1.2,collie,True,0.154603,p3,2
467,800141422401830912,2016-11-20 00:59:15,"<a href=""http://twitter.com/download/iphone"" rel=""nofollow"">Twitter for iPhone</a>",This is Peaches. She's the ultimate selfie sidekick. Super sneaky tongue slip appreciated. 13/10 https://t.co/pbKOesr8Tg,13,10,Peaches,None,16807,2914,1.3,labrador_retriever,True,0.0229773,p3,3
468,800018252395122689,2016-11-19 16:49:49,"<a href=""http://twitter.com/download/iphone"" rel=""nofollow"">Twitter for iPhone</a>",Here's a doggo doin a struggle. 11/10 much determined https://t.co/gQqRBfkX4I,11,10,None,doggo,31236,14982,1.1,barbell,False,0.14363,p3,1
469,799774291445383169,2016-11-19 00:40:24,"<a href=""http://twitter.com/download/iphone"" rel=""nofollow"">Twitter for iPhone</a>",RT @dog_rates: This is Tucker. He would like a hug. 13/10 someone hug him https://t.co/wdgY9oHPrT,13,10,Tucker,None,0,5343,1.3,pomeranian,True,0.157524,p3,1
470,799757965289017345,2016-11-18 23:35:32,"<a href=""http://twitter.com/download/iphone"" rel=""nofollow"">Twitter for iPhone</a>",This is Sobe. She's a h*ckin happy doggo. Only one leg tho. Must have good balance. 13/10 would smile back https://t.co/OiH8PaOxB1,13,10,Sobe,doggo,9247,2456,1.3,shetland_sheepdog,True,0.196399,p3,1
471,799422933579902976,2016-11-18 01:24:14,"<a href=""http://twitter.com/download/iphone"" rel=""nofollow"">Twitter for iPhone</a>",This is Longfellow (prolly sophisticated). He's a North Appalachian Oatzenjammer. Concerned about wrinkled feets. 12/10 would hug softly https://t.co/bpLuQuxzHZ,12,10,Longfellow,None,8831,2166,1.2,toy_terrier,True,0.0185501,p3,1
472,799297110730567681,2016-11-17 17:04:16,"<a href=""http://twitter.com/download/iphone"" rel=""nofollow"">Twitter for iPhone</a>",This is Jeffrey. He's quite the jokester. Takes it too far sometimes. Still 11/10 would pet https://t.co/YDtZcAiMAf,11,10,Jeffrey,None,10890,3160,1.1,eskimo_dog,True,0.00544281,p3,1
473,799063482566066176,2016-11-17 01:35:54,"<a href=""http://twitter.com/download/iphone"" rel=""nofollow"">Twitter for iPhone</a>",This is Mister. He only wears the most fashionable af headwear. 11/10 h*ckin stylish https://t.co/BXJFKOVnJm,11,10,Mister,None,8893,2792,1.1,australian_terrier,True,0.21420300000000006,p3,2
474,798933969379225600,2016-11-16 17:01:16,"<a href=""http://twitter.com/download/iphone"" rel=""nofollow"">Twitter for iPhone</a>",This is Iroh. He's in a predicament. 12/10 someone help him https://t.co/KJAKO2kXsL,12,10,Iroh,None,14490,5087,1.2,malamute,True,0.0443508,p3,1
475,798925684722855936,2016-11-16 16:28:21,"<a href=""http://twitter.com/download/iphone"" rel=""nofollow"">Twitter for iPhone</a>",This is Shadow. He's a firm believer that they're all good dogs. H*ckin passionate about it too. 11/10 I stand with Shadow https://t.co/8yvpacwBcu,11,10,Shadow,None,8152,1630,1.1,norfolk_terrier,True,0.163024,p3,1
476,798697898615730177,2016-11-16 01:23:12,"<a href=""http://twitter.com/download/iphone"" rel=""nofollow"">Twitter for iPhone</a>",RT @dog_rates: This is Stubert. He just arrived. 10/10 https://t.co/HVGs5aAKAn,10,10,Stubert,None,0,7410,1.0,pug,True,0.00765137,p3,1
477,798694562394996736,2016-11-16 01:09:57,"<a href=""http://twitter.com/download/iphone"" rel=""nofollow"">Twitter for iPhone</a>","RT @dog_rates: I'm not sure what's happening here, but it's pretty spectacular. 12/10 for both https://t.co/JKXh0NbBNL",12,10,None,None,0,5670,1.2,basenji,True,0.08446569999999999,p3,1
478,798673117451325440,2016-11-15 23:44:44,"<a href=""http://twitter.com/download/iphone"" rel=""nofollow"">Twitter for iPhone</a>","RT @dog_rates: I shall call him squishy and he shall be mine, and he shall be my squishy. 13/10 https://t.co/WId5lxNdPH",13,10,None,None,0,6332,1.3,french_loaf,False,0.0181889,p3,1
479,798665375516884993,2016-11-15 23:13:58,"<a href=""http://twitter.com/download/iphone"" rel=""nofollow"">Twitter for iPhone</a>",RT @dog_rates: This is Lola. She fell asleep on a piece of pizza. 10/10 frighteningly relatable https://t.co/eqmkr2gmPH,10,10,Lola,None,0,4427,1.0,pomeranian,True,0.0560567,p3,1
480,798644042770751489,2016-11-15 21:49:12,"<a href=""http://twitter.com/download/iphone"" rel=""nofollow"">Twitter for iPhone</a>",RT @dog_rates: This is Paull. He just stubbed his toe. 10/10 deep breaths Paull https://t.co/J5Mqn8VeYq,10,10,Paull,None,0,2103,1.0,welsh_springer_spaniel,True,0.137186,p3,1
481,798628517273620480,2016-11-15 20:47:30,"<a href=""http://twitter.com/download/iphone"" rel=""nofollow"">Twitter for iPhone</a>",RT @dog_rates: This a Norwegian Pewterschmidt named Tickles. Ears for days. 12/10 I care deeply for Tickles https://t.co/0aDF62KVP7,12,10,None,None,0,2227,1.2,golden_retriever,True,0.08254919999999999,p3,1
482,798340744599797760,2016-11-15 01:44:00,"<a href=""http://twitter.com/download/iphone"" rel=""nofollow"">Twitter for iPhone</a>",RT @dog_rates: This is Davey. He'll have your daughter home by 8. Just a stand up pup. 11/10 would introduce to mom https://t.co/E6bGWf9EOm,11,10,Davey,None,0,3825,1.1,border_collie,True,0.121626,p3,1
483,798209839306514432,2016-11-14 17:03:50,"<a href=""http://twitter.com/download/iphone"" rel=""nofollow"">Twitter for iPhone</a>",This is Cooper. His bow tie was too heavy for the front so he moved it to the side. Balanced af now. 13/10 https://t.co/jG1PAFkB81,13,10,Cooper,None,11388,2894,1.3,pomeranian,True,0.0978931,p3,1
484,797971864723324932,2016-11-14 01:18:12,"<a href=""http://twitter.com/download/iphone"" rel=""nofollow"">Twitter for iPhone</a>",Here's a helicopter pupper. He takes off at random. H*ckin hard to control. 12/10 rare af https://t.co/GRWPgNKt2z,12,10,None,pupper,12815,3571,1.2,staffordshire_bullterrier,True,0.0727991,p3,1
485,797545162159308800,2016-11-12 21:02:38,"<a href=""http://twitter.com/download/iphone"" rel=""nofollow"">Twitter for iPhone</a>",This is Cassie. She steals things. Guilt increases slightly each time. 12/10 would forgive almost immediately https://t.co/Ia19irLwyB,12,10,Cassie,None,15953,5506,1.2,papillon,True,0.00973566,p3,1
486,797236660651966464,2016-11-12 00:36:46,"<a href=""http://twitter.com/download/iphone"" rel=""nofollow"">Twitter for iPhone</a>",This is Pancake. She loves Batman and winks like a h*ckin champ. 12/10 real crowd pleaser https://t.co/6kqsAjJNhi,12,10,Pancake,None,21979,7538,1.2,kelpie,True,0.0483681,p3,2
487,796865951799083009,2016-11-11 00:03:42,"<a href=""http://twitter.com/download/iphone"" rel=""nofollow"">Twitter for iPhone</a>",This is Tyr. He's just checking on you. Nifty af tongue slip. 12/10 would absolutely pet https://t.co/Jgnuiyvq06,12,10,Tyr,None,8430,2154,1.2,pembroke,True,0.034505,p3,1
488,796759840936919040,2016-11-10 17:02:03,"<a href=""http://twitter.com/download/iphone"" rel=""nofollow"">Twitter for iPhone</a>",Say hello to Romeo. He was just told that it's too cold for the pool. H*ckin nonsense. 11/10 would help fill up https://t.co/6hx7ur6sNI,11,10,Romeo,None,13061,3482,1.1,weimaraner,True,0.137587,p3,1
489,796484825502875648,2016-11-09 22:49:15,"<a href=""http://twitter.com/download/iphone"" rel=""nofollow"">Twitter for iPhone</a>",Here's a sleepy doggo that requested some assistance. 12/10 would carry everywhere https://t.co/bvkkqOjNDV,12,10,None,doggo,8334,2003,1.2,australian_terrier,True,0.0998434,p3,1
490,796387464403357696,2016-11-09 16:22:22,"<a href=""http://twitter.com/download/iphone"" rel=""nofollow"">Twitter for iPhone</a>",This is Snicku. He's having trouble reading because he's a dog. Glasses only helped a little. Nap preferred. 12/10 would snug well https://t.co/cVLUasbKA5,12,10,Snicku,None,12122,4735,1.2,siamese_cat,False,0.052423,p3,1
491,796177847564038144,2016-11-09 02:29:25,"<a href=""http://twitter.com/download/iphone"" rel=""nofollow"">Twitter for iPhone</a>",RT @dog_rates: This is Ruby. She just turned on the news. Officially terrified. 11/10 deep breaths Ruby https://t.co/y5KarNXWXt,11,10,Ruby,None,0,16261,1.1,seat_belt,False,0.0873548,p3,1
492,796149749086875649,2016-11-09 00:37:46,"<a href=""http://twitter.com/download/iphone"" rel=""nofollow"">Twitter for iPhone</a>",This is Ruby. She just turned on the news. Officially terrified. 11/10 deep breaths Ruby https://t.co/y5KarNXWXt,11,10,Ruby,None,35616,16261,1.1,seat_belt,False,0.0873548,p3,1
493,796116448414461957,2016-11-08 22:25:27,"<a href=""http://twitter.com/download/iphone"" rel=""nofollow"">Twitter for iPhone</a>",I didn't believe it at first but now I can see that voter fraud is a serious h*ckin issue. 11/10 https://t.co/7i0bDMbrVN,11,10,None,None,9985,2750,1.1,papillon,True,0.0171099,p3,1
494,796080075804475393,2016-11-08 20:00:55,"<a href=""http://twitter.com/download/iphone"" rel=""nofollow"">Twitter for iPhone</a>",This is Yogi. He's 98% floof. Snuggable af. 12/10 https://t.co/opoXKxmfFm,12,10,Yogi,None,9287,2626,1.2,gibbon,False,0.00235832,p3,1
495,796031486298386433,2016-11-08 16:47:50,"<a href=""http://twitter.com/download/iphone"" rel=""nofollow"">Twitter for iPhone</a>",This is Daisy. She's here to make your day better. 13/10 mission h*ckin successful https://t.co/PbgvuD0qIL,13,10,Daisy,None,11873,4199,1.3,doormat,False,0.00841853,p3,1
496,795464331001561088,2016-11-07 03:14:10,"<a href=""http://twitter.com/download/iphone"" rel=""nofollow"">Twitter for iPhone</a>",Elder doggo does a splash. Both 13/10 incredible stuff https://t.co/gBUDjdEcqz,13,10,None,doggo,54834,27093,1.3,soft-coated_wheaten_terrier,True,0.124684,p3,1
497,795400264262053889,2016-11-06 22:59:35,"<a href=""http://twitter.com/download/iphone"" rel=""nofollow"">Twitter for iPhone</a>",This is Brody. He's trying to make the same face as the football. 12/10 https://t.co/2H4MfOGlpQ,12,10,Brody,None,11109,3255,1.2,tennis_ball,False,0.00449534,p3,2
498,795076730285391872,2016-11-06 01:33:58,"<a href=""http://twitter.com/download/iphone"" rel=""nofollow"">Twitter for iPhone</a>",This is Bailey. She loves going down slides but is very bad at it. Still 11/10 https://t.co/ivPWhspN3E,11,10,Bailey,None,17847,6160,1.1,swing,False,0.0446596,p3,2
499,794983741416415232,2016-11-05 19:24:28,"<a href=""http://twitter.com/download/iphone"" rel=""nofollow"">Twitter for iPhone</a>",RT @dog_rates: This is Rizzy. She smiles a lot. 12/10 contagious af https://t.co/TU4sZogVIq,12,10,Rizzy,None,0,3832,1.2,norwegian_elkhound,True,0.151024,p3,3
500,794926597468000259,2016-11-05 15:37:24,"<a href=""http://twitter.com/download/iphone"" rel=""nofollow"">Twitter for iPhone</a>",This is Mack. He's rather h*ckin sleepy. Exceptional ears. 12/10 would boop https://t.co/XRPvTPF0VH,12,10,Mack,None,11301,2633,1.2,toy_poodle,True,0.0376618,p3,1
501,794355576146903043,2016-11-04 01:48:22,"<a href=""http://twitter.com/download/iphone"" rel=""nofollow"">Twitter for iPhone</a>",RT @dog_rates: This is Butter. She can have whatever she wants forever. 12/10 would hug softly https://t.co/x5gXRS1abq,12,10,Butter,None,0,11718,1.2,jigsaw_puzzle,False,0.041475800000000014,p3,1
502,794332329137291264,2016-11-04 00:15:59,"<a href=""http://twitter.com/download/iphone"" rel=""nofollow"">Twitter for iPhone</a>",This is Nimbus (like the cloud). He just bought this fancy af duck raincoat. Only protects one ear tho. 12/10 so h*ckin floofy https://t.co/SIQbb8c3AU,12,10,Nimbus,None,10509,3008,1.2,great_pyrenees,True,0.00290129,p3,1
503,794205286408003585,2016-11-03 15:51:10,"<a href=""http://twitter.com/download/iphone"" rel=""nofollow"">Twitter for iPhone</a>",This is Laika. She was a space pupper. The first space pupper actually. Orbited earth like a h*ckin boss. 14/10 hero af https://t.co/trSjgY3h4g,14,10,Laika,pupper,10136,3788,1.4,brass,False,0.0203711,p3,3
504,793962221541933056,2016-11-02 23:45:19,"<a href=""http://twitter.com/download/iphone"" rel=""nofollow"">Twitter for iPhone</a>",This is Maximus. His face is stuck like that. Tragic really. Great tongue tho. 12/10 would pet firmly https://t.co/xIfrsMNLBR,12,10,Maximus,None,18538,5568,1.2,staffordshire_bullterrier,True,0.016496700000000003,p3,1
505,793845145112371200,2016-11-02 16:00:06,"<a href=""http://twitter.com/download/iphone"" rel=""nofollow"">Twitter for iPhone</a>",This is Clark. He was just caught wearing pants. 13/10 game-changing af https://t.co/2Xo19aPrG5,13,10,Clark,None,10132,2131,1.3,kerry_blue_terrier,True,0.0476617,p3,1
506,793614319594401792,2016-11-02 00:42:53,"<a href=""http://twitter.com/download/iphone"" rel=""nofollow"">Twitter for iPhone</a>",RT @dog_rates: When she says you're a good boy and you know you're a good boy because you're a good boy. 13/10 https://t.co/O5IUmRHRIh,13,10,None,None,0,3568,1.3,kuvasz,True,0.015965,p3,1
507,793601777308463104,2016-11-01 23:53:02,"<a href=""http://twitter.com/download/iphone"" rel=""nofollow"">Twitter for iPhone</a>",This is Dobby. I can't stop looking at her feet. 12/10 would absolutely snug https://t.co/LhzPWv6rTv,12,10,Dobby,None,8782,1859,1.2,toy_terrier,True,0.0891487,p3,1
508,793500921481273345,2016-11-01 17:12:16,"<a href=""http://twitter.com/download/iphone"" rel=""nofollow"">Twitter for iPhone</a>",This is Fiona. She's an extremely mediocre copilot. Very distracting. Wink makes up for all the missed turns. 12/10 https://t.co/aF5MmpvPqN,12,10,Fiona,None,11766,2712,1.2,chesapeake_bay_retriever,True,0.163366,p3,2
509,793286476301799424,2016-11-01 03:00:09,"<a href=""http://twitter.com/download/iphone"" rel=""nofollow"">Twitter for iPhone</a>",This is Moreton. He's the Good Boy Who Lived. 13/10 magical as h*ck https://t.co/rLHGx3VAF3,13,10,Moreton,None,27119,10451,1.3,doormat,False,0.109677,p3,1
510,793271401113350145,2016-11-01 02:00:14,"<a href=""http://twitter.com/download/iphone"" rel=""nofollow"">Twitter for iPhone</a>",Meet Dave. It's his favorite day of the year. He gets to fulfill his dream of being a dinosaur. 12/10 inspirational af https://t.co/MgQSdfZGPN,12,10,Dave,None,9498,2683,1.2,pembroke,True,0.0701195,p3,1
511,793256262322548741,2016-11-01 01:00:05,"<a href=""http://twitter.com/download/iphone"" rel=""nofollow"">Twitter for iPhone</a>",Oh h*ck look at this spookling right here. Fright level off the charts. 12/10 sufficiently spooked https://t.co/BNy9IIJMb0,12,10,None,None,21983,9462,1.2,beagle,True,0.0412205,p3,1
512,793241302385262592,2016-11-01 00:00:38,"<a href=""http://twitter.com/download/iphone"" rel=""nofollow"">Twitter for iPhone</a>",This is Tucker. He's out here bustin h*ckin ghosts. 13/10 dedicated af https://t.co/Ap477GhwXt,13,10,Tucker,None,11588,3727,1.3,cocker_spaniel,True,0.0363157,p3,1
513,793226087023144960,2016-10-31 23:00:11,"<a href=""http://twitter.com/download/iphone"" rel=""nofollow"">Twitter for iPhone</a>","This is Juno. She spooked me up real good, but only to get my attention. Above average handwriting for a dog I think. 11/10 https://t.co/hFxxBCWlwj",11,10,Juno,None,10821,3251,1.1,english_springer,True,0.0836433,p3,1
514,793210959003287553,2016-10-31 22:00:04,"<a href=""http://twitter.com/download/iphone"" rel=""nofollow"">Twitter for iPhone</a>",This is Maude. She's the h*ckin happiest wasp you've ever seen. 10/10 would pet with caution https://t.co/etL8FHBrh8,10,10,Maude,None,9831,3214,1.0,boston_bull,True,0.0151344,p3,1
515,793195938047070209,2016-10-31 21:00:23,"<a href=""http://twitter.com/download/iphone"" rel=""nofollow"">Twitter for iPhone</a>",Say hello to Lily. She's pupset that her costume doesn't fit as well as last year. 12/10 poor puppo https://t.co/YSi6K1firY,12,10,Lily,puppo,16800,6384,1.2,chihuahua,True,0.0423393,p3,2
516,793180763617361921,2016-10-31 20:00:05,"<a href=""http://twitter.com/download/iphone"" rel=""nofollow"">Twitter for iPhone</a>",This is Newt. He's a strawberry. 11/10 https://t.co/2VhmlwxA1Q,11,10,Newt,None,7603,2251,1.1,airedale,True,0.13296,p3,1
517,793165685325201412,2016-10-31 19:00:10,"<a href=""http://twitter.com/download/iphone"" rel=""nofollow"">Twitter for iPhone</a>",This is Benji. He's Air Bud. It's a low effort costume but he pulls it off rather h*ckin well. 12/10 would happily get dunked on https://t.co/IbzT7DJvBo,12,10,Benji,None,10345,3164,1.2,doormat,False,0.00235285,p3,1
518,793150605191548928,2016-10-31 18:00:14,"<a href=""http://twitter.com/download/iphone"" rel=""nofollow"">Twitter for iPhone</a>",This is Nida. She's a free elf. Waited so long for this day. 11/10 https://t.co/3lE8Izgmkf,11,10,Nida,None,6785,1942,1.1,standard_poodle,True,0.12598199999999998,p3,1
519,793135492858580992,2016-10-31 17:00:11,"<a href=""http://twitter.com/download/iphone"" rel=""nofollow"">Twitter for iPhone</a>",Your favorite squad is looking extra h*ckin spooky today. 13/10 for all https://t.co/PrgvOyPtDT,13,10,None,None,7100,2823,1.3,teddy,False,0.0465926,p3,1
520,793120401413079041,2016-10-31 16:00:13,"<a href=""http://twitter.com/download/iphone"" rel=""nofollow"">Twitter for iPhone</a>","This is Robin. She's desperately trying to do me a frighten, but her tongue drastically decreases her spook value. Still 11/10 great effort https://t.co/sxMrsOZ8zb",11,10,Robin,None,13956,4436,1.1,kuvasz,True,0.0355023,p3,1
521,792913359805018113,2016-10-31 02:17:31,"<a href=""http://twitter.com/download/iphone"" rel=""nofollow"">Twitter for iPhone</a>",Here is a perfect example of someone who has their priorities in order. 13/10 for both owner and Forrest https://t.co/LRyMrU7Wfq,13,10,None,None,15792,4578,1.3,switch,False,0.0390086,p3,4
522,792883833364439040,2016-10-31 00:20:11,"<a href=""http://twitter.com/download/iphone"" rel=""nofollow"">Twitter for iPhone</a>",This is Bailey. She's rather h*ckin hype for Halloween tomorrow. Carved those pupkins herself. 12/10 https://t.co/v17mFm0Ftz,12,10,Bailey,None,12452,4855,1.2,standard_poodle,True,8.31451e-05,p3,3
523,792773781206999040,2016-10-30 17:02:53,"<a href=""http://twitter.com/download/iphone"" rel=""nofollow"">Twitter for iPhone</a>",This is Monster. Not an actual monster tho. He's showing you his tongue. Very impressive Monster. 12/10 would snug https://t.co/RhaPExuxJL,12,10,Monster,None,8072,1916,1.2,australian_terrier,True,0.00445069,p3,1
524,792394556390137856,2016-10-29 15:55:58,"<a href=""http://twitter.com/download/iphone"" rel=""nofollow"">Twitter for iPhone</a>",Meet BeBe. She rocks the messy bun of your dreams. H*ckin flawless. 12/10 would watch her tutorial https://t.co/of0pFNBIl8,12,10,BeBe,None,14863,4878,1.2,miniature_poodle,True,0.061078199999999985,p3,2
525,792050063153438720,2016-10-28 17:07:05,"<a href=""http://twitter.com/download/iphone"" rel=""nofollow"">Twitter for iPhone</a>",This is Remus. He's a mop that came to life. Can't see anything. Constantly trips over himself. Still a very good dog. 11/10 https://t.co/S3f1SYylzu,11,10,Remus,None,7906,2037,1.1,tibetan_terrier,True,0.002743,p3,2
526,791672322847637504,2016-10-27 16:06:04,"<a href=""http://twitter.com/download/iphone"" rel=""nofollow"">Twitter for iPhone</a>",When she says you're a good boy and you know you're a good boy because you're a good boy. 13/10 https://t.co/O5IUmRHRIh,13,10,None,None,12929,3568,1.3,kuvasz,True,0.015965,p3,1
527,791406955684368384,2016-10-26 22:31:36,"<a href=""http://twitter.com/download/iphone"" rel=""nofollow"">Twitter for iPhone</a>",Say hello to Levi. He's a Madagascan Butterbop. One of the more docile Butterbops I've seen. 12/10 would give all the pets https://t.co/Zcw9Sccctc,12,10,Levi,None,14435,4670,1.2,basenji,True,0.000152502,p3,4
528,791312159183634433,2016-10-26 16:14:55,"<a href=""http://twitter.com/download/iphone"" rel=""nofollow"">Twitter for iPhone</a>",This is Mabel. She's super h*ckin smol. Portable af. Comes with the smol shoe. 12/10 would keep in frocket https://t.co/GGJvxYt3xK,12,10,Mabel,None,9671,2889,1.2,doberman,True,0.00354426,p3,4
529,791026214425268224,2016-10-25 21:18:40,"<a href=""http://twitter.com/download/iphone"" rel=""nofollow"">Twitter for iPhone</a>",RT @dog_rates: This is Alfie. He's touching a butt. Couldn't be happier. 11/10 https://t.co/gx3xF5mZbo,11,10,Alfie,None,0,4691,1.1,keeshond,True,0.0505276,p3,1
530,790987426131050500,2016-10-25 18:44:32,"<a href=""http://twitter.com/download/iphone"" rel=""nofollow"">Twitter for iPhone</a>",This is Misty. She has a cowboy hat on her nose. 12/10 https://t.co/Eno0mypHIr,12,10,Misty,None,10903,2421,1.2,newfoundland,True,0.104768,p3,1
531,790946055508652032,2016-10-25 16:00:09,"<a href=""http://twitter.com/download/iphone"" rel=""nofollow"">Twitter for iPhone</a>",This is Betty. She's assisting with the dishes. Such a good puppo. 12/10 h*ckin helpful af https://t.co/dgvTPZ9tgI,12,10,Betty,puppo,18267,5346,1.2,chow,True,0.0390117,p3,1
532,790723298204217344,2016-10-25 01:14:59,"<a href=""http://twitter.com/download/iphone"" rel=""nofollow"">Twitter for iPhone</a>",RT @dog_rates: This is Happy. He's a bathtub reviewer. Seems to be pleased with this one. 12/10 https://t.co/Ln89R4FP7v,12,10,Happy,None,0,2636,1.2,golden_retriever,True,0.07853049999999999,p3,1
533,790698755171364864,2016-10-24 23:37:28,"<a href=""http://twitter.com/download/iphone"" rel=""nofollow"">Twitter for iPhone</a>",This is Mosby. He appears to be rather h*ckin snuggable af. 12/10 keep it up Mosby https://t.co/IiiBq460I7,12,10,Mosby,None,9026,2160,1.2,appenzeller,True,0.000997907,p3,1
534,790581949425475584,2016-10-24 15:53:19,"<a href=""http://twitter.com/download/iphone"" rel=""nofollow"">Twitter for iPhone</a>",This is Duke. He sneaks into the fridge sometimes. It's his safe place. 11/10 would give little jacket if necessary https://t.co/Fd5WFDTMH4,11,10,Duke,None,22749,8138,1.1,kelpie,True,0.000130817,p3,2
535,790337589677002753,2016-10-23 23:42:19,"<a href=""http://twitter.com/download/iphone"" rel=""nofollow"">Twitter for iPhone</a>",Meet Maggie. She can hear your cells divide. 12/10 can also probably fly https://t.co/ovE2hqXryV,12,10,Maggie,None,8611,2122,1.2,toy_terrier,True,0.102299,p3,1
536,790277117346975746,2016-10-23 19:42:02,"<a href=""http://twitter.com/download/iphone"" rel=""nofollow"">Twitter for iPhone</a>",This is Bruce. He never backs down from a challenge. 11/10 you got this Bruce https://t.co/aI7umZHIq7,11,10,Bruce,None,13817,3654,1.1,curly-coated_retriever,True,0.146427,p3,1
537,789986466051088384,2016-10-23 00:27:05,"<a href=""http://twitter.com/download/iphone"" rel=""nofollow"">Twitter for iPhone</a>",This is Happy. He's a bathtub reviewer. Seems to be pleased with this one. 12/10 https://t.co/Ln89R4FP7v,12,10,Happy,None,10201,2636,1.2,golden_retriever,True,0.07853049999999999,p3,1
538,789628658055020548,2016-10-22 00:45:17,"<a href=""http://twitter.com/download/iphone"" rel=""nofollow"">Twitter for iPhone</a>",This is Eli. He can fly. 13/10 magical af https://t.co/huPSJJ7FDI,13,10,Eli,None,8300,2024,1.3,pomeranian,True,0.0798831,p3,1
539,789599242079838210,2016-10-21 22:48:24,"<a href=""http://twitter.com/download/iphone"" rel=""nofollow"">Twitter for iPhone</a>",This is Brownie. She's wearing a Halloween themed onesie. 12/10 festive af https://t.co/0R4meWXFOx,12,10,Brownie,None,7476,2197,1.2,labrador_retriever,True,0.0174985,p3,2
