,tweet_id,timestamp,source,text,rating_numerator,rating_denominator,name,dog_stage,favorite_count,retweet_count,real_rating,class,dog,conf,conf_type,img_num
945,727314416056803329,2016-05-03 01:50:44,"<a href=""http://twitter.com/download/iphone"" rel=""nofollow"">Twitter for iPhone</a>",This pupper was about to explain where that dirt came from but then decided against it. 11/10 https://t.co/SbaelU6zRs,11,10,None,pupper,3557,822,1.1,tibetan_terrier,True,0.00173075,p3,2
946,727286334147182592,2016-05-02 23:59:09,"<a href=""http://twitter.com/download/iphone"" rel=""nofollow"">Twitter for iPhone</a>",I swear to god if we get sent another Blue Madagascan Peacock we'll deactivate. We ðŸ‘ Only ðŸ‘ Rate ðŸ‘ Dogs... 9/10 https://t.co/bbta2Q4URK,9,10,None,None,3258,902,0.9,chihuahua,True,0.0705542,p3,1
947,727175381690781696,2016-05-02 16:38:15,"<a href=""http://twitter.com/download/iphone"" rel=""nofollow"">Twitter for iPhone</a>",This is Karll. He just wants to go kayaking. 10/10 please someone take Karll kayaking already https://t.co/vXLkvyNQHp,10,10,Karll,None,4147,1500,1.0,labrador_retriever,True,0.0589085,p3,2
948,726935089318363137,2016-05-02 00:43:25,"<a href=""http://twitter.com/download/iphone"" rel=""nofollow"">Twitter for iPhone</a>",This is Sprout. He's just precious af. 12/10 I'd do anything for Sprout https://t.co/DxlX1yTVYY,12,10,Sprout,None,7382,2686,1.2,lakeland_terrier,True,0.033318,p3,2
949,726887082820554753,2016-05-01 21:32:40,"<a href=""http://twitter.com/download/iphone"" rel=""nofollow"">Twitter for iPhone</a>",This is Blitz. He's a new dad struggling to cope mentally with the pressures of being a father. Sick shades 10/10 https://t.co/2AVcJ2BZsy,10,10,Blitz,None,4117,1650,1.0,chesapeake_bay_retriever,True,0.125182,p3,1
950,726828223124897792,2016-05-01 17:38:46,"<a href=""http://twitter.com/download/iphone"" rel=""nofollow"">Twitter for iPhone</a>",This is Bloop. He's a Phoenician Winnebago. Tongue is just wow. That box is all he has (tragic). 12/10 would caress https://t.co/DWNrPPXgHA,12,10,Bloop,None,3809,1105,1.2,labrador_retriever,True,0.125185,p3,1
951,726224900189511680,2016-04-30 01:41:23,"<a href=""http://twitter.com/download/iphone"" rel=""nofollow"">Twitter for iPhone</a>",I'm getting super heckin frustrated with you all sending in non canines like this ostrich. We only rate dogs... 9/10 https://t.co/Rgbni2Ns8z,9,10,None,None,4731,1275,0.9,bucket,False,0.06994639999999999,p3,1
952,725842289046749185,2016-04-29 00:21:01,"<a href=""http://twitter.com/download/iphone"" rel=""nofollow"">Twitter for iPhone</a>",This is Colby. He's currently regretting all those times he shook your hand for an extra treat. 12/10 https://t.co/vtVHtKFtBH,12,10,Colby,None,7562,2905,1.2,chesapeake_bay_retriever,True,0.121523,p3,1
953,725786712245440512,2016-04-28 20:40:11,"<a href=""http://twitter.com/download/iphone"" rel=""nofollow"">Twitter for iPhone</a>",Say hello to Lillie. She's a Rutabagan Floofem. Poor pupper ate and then passed out. 11/10 relatable af https://t.co/uIdGqug9rw,11,10,Lillie,pupper,4460,1491,1.1,kuvasz,True,0.145715,p3,1
954,725729321944506368,2016-04-28 16:52:08,"<a href=""http://twitter.com/download/iphone"" rel=""nofollow"">Twitter for iPhone</a>",This is Lola. She's a Butternut Splishnsplash. They are known to be ferocious af. 12/10 would absolutely still pet https://t.co/adQt5a6TZU,12,10,Lola,None,5555,1954,1.2,french_bulldog,True,0.141461,p3,1
955,724983749226668032,2016-04-26 15:29:30,"<a href=""http://twitter.com/download/iphone"" rel=""nofollow"">Twitter for iPhone</a>",This is Fred-Rick. He dabbles in parkour. The elevation gives him power. 12/10 hopefully visiting a mailbox near you https://t.co/qFqLtudIiD,12,10,Fred,None,3971,1434,1.2,cocker_spaniel,True,0.0760429,p3,1
956,724771698126512129,2016-04-26 01:26:53,"<a href=""http://twitter.com/download/iphone"" rel=""nofollow"">Twitter for iPhone</a>",Nothin better than a doggo and a sunset. 11/10 https://t.co/JlFqOhrHEs,11,10,None,doggo,2546,706,1.1,english_setter,True,0.0372083,p3,2
957,724405726123311104,2016-04-25 01:12:38,"<a href=""http://twitter.com/download/iphone"" rel=""nofollow"">Twitter for iPhone</a>",This is Ashleigh. She's having Coachella withdrawals. Didn't even go tho. 10/10 stay strong pupper https://t.co/nRUaKWnJfH,10,10,Ashleigh,pupper,5692,1809,1.0,feather_boa,False,0.159348,p3,1
958,724049859469295616,2016-04-24 01:38:33,"<a href=""http://twitter.com/download/iphone"" rel=""nofollow"">Twitter for iPhone</a>",This is Kreggory. He just took a look at his student debt. 10/10 can't even comprehend it https://t.co/XTsZTgilnT,10,10,Kreggory,None,4650,1941,1.0,shetland_sheepdog,True,0.0435842,p3,1
959,724046343203856385,2016-04-24 01:24:35,"<a href=""http://twitter.com/download/iphone"" rel=""nofollow"">Twitter for iPhone</a>","This is Sarge. Not even he knows what his tongue is doing, but it's pretty damn spectacular. 10/10 https://t.co/pIQEdbBxdL",10,10,Sarge,None,2854,609,1.0,great_dane,True,0.0118586,p3,1
960,724004602748780546,2016-04-23 22:38:43,"<a href=""http://twitter.com/download/iphone"" rel=""nofollow"">Twitter for iPhone</a>",This is Luther. He saw a ghost. Spooked af. 11/10 hang in there pupper https://t.co/EdKG43VvEl,11,10,Luther,pupper,4485,1741,1.1,quilt,False,0.007627600000000002,p3,3
961,723912936180330496,2016-04-23 16:34:28,"<a href=""http://twitter.com/download/iphone"" rel=""nofollow"">Twitter for iPhone</a>",This is Sugar. She's a Bolivian Superfloof. Spherical af. 12/10 would never let go of https://t.co/AhMfUu6Onm,12,10,Sugar,None,4163,1347,1.2,chow,True,0.00223183,p3,1
962,723688335806480385,2016-04-23 01:41:59,"<a href=""http://twitter.com/download/iphone"" rel=""nofollow"">Twitter for iPhone</a>",This is Reginald. He starts screaming at random. 12/10 cuddly af https://t.co/YgNuDQbv89,12,10,Reginald,None,8285,3274,1.2,irish_terrier,True,0.06530570000000001,p3,2
963,723673163800948736,2016-04-23 00:41:42,"<a href=""http://twitter.com/download/iphone"" rel=""nofollow"">Twitter for iPhone</a>",This is Ivar. She is a badass Viking warrior. Will sack your village. 10/10 savage af https://t.co/Dz6MiVssVU,10,10,Ivar,None,3241,985,1.0,hand_blower,False,0.012941,p3,1
964,723179728551723008,2016-04-21 16:00:57,"<a href=""http://twitter.com/download/iphone"" rel=""nofollow"">Twitter for iPhone</a>",This is Jangle. She's addicted to broccoli. It's the only thing she cares about. Tragic af. 8/10 get help pup https://t.co/8dNWp1cSEa,8,10,Jangle,None,5669,2059,0.8,norwegian_elkhound,True,0.0568505,p3,1
965,722974582966214656,2016-04-21 02:25:47,"<a href=""http://twitter.com/download/iphone"" rel=""nofollow"">Twitter for iPhone</a>",Happy 4/20 from the squad! 13/10 for all https://t.co/eV1diwds8a,4,20,None,None,4407,1723,0.2,weimaraner,True,0.0852969,p3,1
966,722613351520608256,2016-04-20 02:30:23,"<a href=""http://twitter.com/download/iphone"" rel=""nofollow"">Twitter for iPhone</a>",Meet Schnitzel. He's a Tropicana Floofboop. Getting too big for his favorite basket. 12/10 just so damn fluffy https://t.co/qjd0UJKYUY,12,10,Schnitzel,None,5301,1796,1.2,chow,True,0.0448537,p3,1
967,721503162398597120,2016-04-17 00:58:53,"<a href=""http://twitter.com/download/iphone"" rel=""nofollow"">Twitter for iPhone</a>",This is Panda. He's happy af. 11/10 https://t.co/IOAk9i4UvE,11,10,Panda,None,4994,2066,1.1,pekinese,True,0.000775002,p3,3
968,721001180231503872,2016-04-15 15:44:11,"<a href=""http://twitter.com/download/iphone"" rel=""nofollow"">Twitter for iPhone</a>",This is Oliver. Bath time is upon him. His fear of the wetness postpones his ultimate pupper destiny. 11/10 https://t.co/AFzzKqR4tT,11,10,Oliver,pupper,2706,676,1.1,tub,False,0.00624335,p3,1
969,720785406564900865,2016-04-15 01:26:47,"<a href=""http://twitter.com/download/iphone"" rel=""nofollow"">Twitter for iPhone</a>",This is Archie. He hears everything you say. Doesn't matter where you are. 12/10 https://t.co/0l4I8famYp,12,10,Archie,None,3337,846,1.2,kelpie,True,0.0179158,p3,1
970,720775346191278080,2016-04-15 00:46:48,"<a href=""http://twitter.com/download/iphone"" rel=""nofollow"">Twitter for iPhone</a>",This is Berkeley. He's in a predicament. 10/10 someone help him https://t.co/XSEXdQupej,10,10,Berkeley,None,2652,745,1.0,giant_schnauzer,True,0.07906669999999999,p3,1
971,720415127506415616,2016-04-14 00:55:25,"<a href=""http://twitter.com/download/iphone"" rel=""nofollow"">Twitter for iPhone</a>",Garden's coming in nice this year. 10/10 https://t.co/5Lra3e4rrw,10,10,None,None,4422,1640,1.0,american_black_bear,False,0.00173312,p3,1
972,720389942216527872,2016-04-13 23:15:21,"<a href=""http://twitter.com/download/iphone"" rel=""nofollow"">Twitter for iPhone</a>",This is RalphÃ©. He patrols the lake. Looking for babes. 11/10 https://t.co/Pb6iMmo0wk,11,10,RalphÃ©,None,6870,2768,1.1,eskimo_dog,True,0.0191971,p3,1
973,720340705894408192,2016-04-13 19:59:42,"<a href=""http://twitter.com/download/iphone"" rel=""nofollow"">Twitter for iPhone</a>",This is Derek. He just got balled on. Can't even get up. Poor thing. 10/10 hang in there pupper https://t.co/BIRRF3bcWH,10,10,Derek,pupper,3070,1072,1.0,viaduct,False,0.065321,p3,1
974,720059472081784833,2016-04-13 01:22:10,"<a href=""http://twitter.com/download/iphone"" rel=""nofollow"">Twitter for iPhone</a>",This is Charleson. He lost his plunger. Looked everywhere. Can't find it. So sad. 9/10 would comfort https://t.co/pRHX8yn9Yu,9,10,Charleson,None,4165,1243,0.9,italian_greyhound,True,0.0948181,p3,1
975,720043174954147842,2016-04-13 00:17:25,"<a href=""http://twitter.com/download/iphone"" rel=""nofollow"">Twitter for iPhone</a>",This is Neptune. He's a Snowy Swiss Mountain Floofapolis. Cheeky wink. Tongue nifty af. 11/10 would pet so firmly https://t.co/SoZq2Xoopv,11,10,Neptune,None,5251,2200,1.1,white_wolf,False,0.00446203,p3,1
976,719991154352222208,2016-04-12 20:50:42,"<a href=""http://twitter.com/download/iphone"" rel=""nofollow"">Twitter for iPhone</a>",This doggo was initially thrilled when she saw the happy cartoon pup but quickly realized she'd been deceived. 10/10 https://t.co/mvnBGaWULV,10,10,None,doggo,5187,1927,1.0,labrador_retriever,True,0.0946916,p3,2
977,719704490224398336,2016-04-12 01:51:36,"<a href=""http://twitter.com/download/iphone"" rel=""nofollow"">Twitter for iPhone</a>",This is Clyde. He's making sure you're having a good train ride. 12/10 great pupper https://t.co/y206kWHAj0,12,10,Clyde,pupper,4882,1591,1.2,bathtub,False,0.0355282,p3,1
978,719551379208073216,2016-04-11 15:43:12,"<a href=""http://twitter.com/download/iphone"" rel=""nofollow"">Twitter for iPhone</a>",This is Harnold. He accidentally opened the front facing camera. 10/10 get it together Harnold https://t.co/S6JHaSMtln,10,10,Harnold,None,5415,2126,1.0,eskimo_dog,True,0.035745,p3,1
979,719367763014393856,2016-04-11 03:33:34,"<a href=""http://twitter.com/download/iphone"" rel=""nofollow"">Twitter for iPhone</a>",Meet Sid &amp; Murphy. Murphy floats alongside Sid and whispers motivational quotes in his ear. Magical af. Both 11/10 https://t.co/7mmjyearQW,11,10,Sid,None,2980,812,1.1,tibetan_terrier,True,0.0477594,p3,1
980,719339463458033665,2016-04-11 01:41:07,"<a href=""http://twitter.com/download/iphone"" rel=""nofollow"">Twitter for iPhone</a>",Say hello to Lucy and Sophie. They think they're the same size. Both 10/10 would snug at same time https://t.co/HW50zkcf2R,10,10,Lucy,None,4724,1370,1.0,leonberg,True,0.0703705,p3,1
981,719332531645071360,2016-04-11 01:13:34,"<a href=""http://twitter.com/download/iphone"" rel=""nofollow"">Twitter for iPhone</a>",This is Pippa. She managed to start the car but is waiting for you to buckle up before driving. Responsible af 11/10 https://t.co/htrlmC7saz,11,10,Pippa,None,3649,1050,1.1,norfolk_terrier,True,0.0906329,p3,1
982,718971898235854848,2016-04-10 01:20:33,"<a href=""http://twitter.com/download/iphone"" rel=""nofollow"">Twitter for iPhone</a>",This is Sadie. She is prepared for battle. 10/10 https://t.co/JRckDkZVRT,10,10,Sadie,None,3742,1209,1.0,labrador_retriever,True,0.0754917,p3,1
983,718939241951195136,2016-04-09 23:10:47,"<a href=""http://twitter.com/download/iphone"" rel=""nofollow"">Twitter for iPhone</a>",This is Otis. Everybody look at Otis. 12/10 would probably faint while petting https://t.co/I9qoe1uEih,12,10,Otis,None,5613,1927,1.2,toilet_tissue,False,0.00675723,p3,1
984,718631497683582976,2016-04-09 02:47:55,"<a href=""http://twitter.com/download/iphone"" rel=""nofollow"">Twitter for iPhone</a>",We normally don't rate marshmallows but this one appears to be flawlessly toasted so I'll make an exception. 10/10 https://t.co/D9jbbmPmos,10,10,None,None,20331,8889,1.0,persian_cat,False,0.000524823,p3,1
985,718613305783398402,2016-04-09 01:35:37,"<a href=""http://twitter.com/download/iphone"" rel=""nofollow"">Twitter for iPhone</a>",This is Carper. He's a Tortellini Angiosperm. In desperate need of a petting. 11/10 would hug softly https://t.co/lK9YDkRzPj,11,10,Carper,None,2625,531,1.1,chesapeake_bay_retriever,True,0.0319751,p3,1
986,718540630683709445,2016-04-08 20:46:50,"<a href=""http://twitter.com/download/iphone"" rel=""nofollow"">Twitter for iPhone</a>",Get you a pup that can do both. 10/10 https://t.co/zSbyvm62xZ,10,10,None,None,2672,1112,1.0,cairn,True,0.044412900000000005,p3,2
987,718460005985447936,2016-04-08 15:26:28,"<a href=""http://twitter.com/download/iphone"" rel=""nofollow"">Twitter for iPhone</a>",Meet Bowie. He's listening for underground squirrels. Smart af. Left eye is considerably magical. 9/10 would so pet https://t.co/JyNmyjy3fe,9,10,Bowie,None,2894,585,0.9,kelpie,True,0.113433,p3,1
988,718454725339934721,2016-04-08 15:05:29,"<a href=""http://twitter.com/download/iphone"" rel=""nofollow"">Twitter for iPhone</a>","This pic is old but I hadn't seen it until today and had to share. Creative af. 13/10 very good boy, would pet well https://t.co/4kD16wMA1Z",13,10,None,None,5222,1650,1.3,chime,False,0.0680916,p3,1
989,718246886998687744,2016-04-08 01:19:36,"<a href=""http://twitter.com/download/iphone"" rel=""nofollow"">Twitter for iPhone</a>",This is Alexanderson. He's got a weird ass birth mark. Dreadful at fetch. Won't eat kibble. 3/10 wtf @Target https://t.co/FmxOpf2Sgl,3,10,Alexanderson,None,2063,554,0.3,siberian_husky,True,0.05749830000000001,p3,1
990,718234618122661888,2016-04-08 00:30:51,"<a href=""http://twitter.com/download/iphone"" rel=""nofollow"">Twitter for iPhone</a>",This is Suki. She was born with a blurry tail (unfortunate). Next level tongue tho. 11/10 nifty hardwood https://t.co/05S8oYztgb,11,10,Suki,None,4141,1099,1.1,eskimo_dog,True,0.271042,p3,1
991,717841801130979328,2016-04-06 22:29:56,"<a href=""http://twitter.com/download/iphone"" rel=""nofollow"">Twitter for iPhone</a>",This is Barclay. His father was a banana. 11/10 appeeling af https://t.co/ucOEfr2rjV,11,10,Barclay,None,2618,655,1.1,bath_towel,False,0.00256079,p3,1
992,717790033953034240,2016-04-06 19:04:14,"<a href=""http://twitter.com/download/iphone"" rel=""nofollow"">Twitter for iPhone</a>","Here's a badass mystery pupper. You weren't aware that you owe him money, but you do. 10/10 shades sick af https://t.co/fv9e9AtzSG",10,10,None,pupper,3110,1242,1.0,cab,False,0.0348464,p3,1
993,717537687239008257,2016-04-06 02:21:30,"<a href=""http://twitter.com/download/iphone"" rel=""nofollow"">Twitter for iPhone</a>",People please. This is a Deadly Mediterranean Plop T-Rex. We only rate dogs. Only send in dogs. Thanks you... 11/10 https://t.co/2ATDsgHD4n,11,10,None,None,6170,2021,1.1,kuvasz,True,0.0498105,p3,1
994,717421804990701568,2016-04-05 18:41:02,"<a href=""http://twitter.com/download/iphone"" rel=""nofollow"">Twitter for iPhone</a>",This is Ebby. She's a Zimbabwean Feta. Embarrassed by ridiculously squishy face. 9/10 would squeeze softly https://t.co/LBJqxMGaHi,9,10,Ebby,None,3378,928,0.9,beagle,True,0.064697,p3,2
995,717047459982213120,2016-04-04 17:53:31,"<a href=""http://twitter.com/download/iphone"" rel=""nofollow"">Twitter for iPhone</a>",This is FlÃ¡vio (pronounced Baxter). He's a Benesnoop Cumberdog. Super rare. Symmetrical. 12/10 would pet so well https://t.co/fGgleFiBPq,12,10,FlÃ¡vio,None,6715,2093,1.2,cocker_spaniel,True,0.00241203,p3,1
996,717009362452090881,2016-04-04 15:22:08,"<a href=""http://twitter.com/download/iphone"" rel=""nofollow"">Twitter for iPhone</a>",This is Smokey. He's having some sort of existential crisis. 10/10 hang in there pupper https://t.co/JmgF4dMpw0,10,10,Smokey,pupper,3505,1078,1.0,malamute,True,0.0606585,p3,1
997,716802964044845056,2016-04-04 01:41:58,"<a href=""http://twitter.com/download/iphone"" rel=""nofollow"">Twitter for iPhone</a>",This is Link. He struggles with couches. 10/10 would assist https://t.co/SbX4e6Yg3o,10,10,Link,None,4567,1288,1.0,bull_mastiff,True,0.06650779999999999,p3,2
998,716791146589110272,2016-04-04 00:55:01,"<a href=""http://twitter.com/download/iphone"" rel=""nofollow"">Twitter for iPhone</a>",Meet Jennifur. She's supposed to be navigating. Not even buckled up. Insubordinate &amp; churlish. 11/10 would still pet https://t.co/h0trcJohYO,11,10,Jennifur,None,5916,1523,1.1,golden_retriever,True,0.12501700000000002,p3,1
999,716439118184652801,2016-04-03 01:36:11,"<a href=""http://twitter.com/download/iphone"" rel=""nofollow"">Twitter for iPhone</a>",This is Bluebert. He just saw that both #FinalFur match ups are split 50/50. Amazed af. 11/10 https://t.co/Kky1DPG4iq,50,50,Bluebert,None,2528,241,1.0,eskimo_dog,True,0.273419,p3,1
1000,716285507865542656,2016-04-02 15:25:47,"<a href=""http://twitter.com/download/iphone"" rel=""nofollow"">Twitter for iPhone</a>",This is Stephanus. She stays woke. 12/10 https://t.co/WIWabMngQZ,12,10,Stephanus,None,2982,1196,1.2,cairn,True,0.07267610000000001,p3,1
1001,716080869887381504,2016-04-02 01:52:38,"<a href=""http://twitter.com/download/iphone"" rel=""nofollow"">Twitter for iPhone</a>",Here's a super majestic doggo and a sunset 11/10 https://t.co/UACnoyi8zu,11,10,None,doggo,5232,1915,1.1,tibetan_mastiff,True,0.0717317,p3,1
1002,715928423106027520,2016-04-01 15:46:52,"<a href=""http://twitter.com/download/iphone"" rel=""nofollow"">Twitter for iPhone</a>",This is Bubbles. He's a Yorkshire Piccolope. 11/10 would snug aggressively https://t.co/3BhMojONxq,11,10,Bubbles,None,3433,966,1.1,bull_mastiff,True,0.00227819,p3,1
1003,715733265223708672,2016-04-01 02:51:22,"<a href=""http://twitter.com/download/iphone"" rel=""nofollow"">Twitter for iPhone</a>",This is a taco. We only rate dogs. Please only send in dogs. Dogs are what we rate. Not tacos. Thank you... 10/10 https://t.co/cxl6xGY8B9,10,10,None,None,4998,1862,1.0,toy_poodle,True,0.0637485,p3,1
1004,715696743237730304,2016-04-01 00:26:15,"<a href=""http://twitter.com/download/iphone"" rel=""nofollow"">Twitter for iPhone</a>",Meet Toby. He's a Lithuanian High-Steppin Stickeroo. One of the more accomplished Stickeroos around. 10/10 so nifty https://t.co/cYPHuJYTjC,10,10,Toby,None,4183,1420,1.0,french_bulldog,True,0.132135,p3,1
1005,715680795826982913,2016-03-31 23:22:53,"<a href=""http://twitter.com/download/iphone"" rel=""nofollow"">Twitter for iPhone</a>",This is Zeus. He's downright fabulous. 12/10 https://t.co/sSugyyRuTp,12,10,Zeus,None,4631,1783,1.2,chow,True,0.00119715,p3,1
1006,715360349751484417,2016-03-31 02:09:32,"<a href=""http://twitter.com/download/iphone"" rel=""nofollow"">Twitter for iPhone</a>",This is Bertson. He just wants to say hi. 11/10 would boop nose https://t.co/hwv7Wq6gDA,11,10,Bertson,None,5853,1730,1.1,padlock,False,0.0239704,p3,1
1007,715342466308784130,2016-03-31 00:58:29,"<a href=""http://twitter.com/download/iphone"" rel=""nofollow"">Twitter for iPhone</a>",This is Oscar. He's a world renowned snowball inspector. It's a ruff job but someone has to do it. 10/10 great guy https://t.co/vSufMAKm3C,10,10,Oscar,None,3236,753,1.0,lakeland_terrier,True,0.136712,p3,1
1008,715220193576927233,2016-03-30 16:52:36,"<a href=""http://twitter.com/download/iphone"" rel=""nofollow"">Twitter for iPhone</a>",This is Nico. His selfie game is strong af. Excellent use of a sneaky tongue slip. 10/10 star material https://t.co/1OBdJkMOFx,10,10,Nico,None,2575,723,1.0,boston_bull,True,0.017400400000000003,p3,1
1009,715200624753819648,2016-03-30 15:34:51,"<a href=""http://twitter.com/download/iphone"" rel=""nofollow"">Twitter for iPhone</a>",This is Michelangelope. He's half coffee cup. Rare af. 12/10 would hug until someone stopped me https://t.co/tvVDY0G911,12,10,Michelangelope,None,5485,2066,1.2,labrador_retriever,True,0.00834409,p3,1
1010,715009755312439296,2016-03-30 02:56:24,"<a href=""http://twitter.com/download/iphone"" rel=""nofollow"">Twitter for iPhone</a>",This is Siba. She's remarkably mobile. Very sleepy as well. 12/10 would happily transport https://t.co/TjnI33RE1i,12,10,Siba,None,4471,1364,1.2,cardigan,True,0.103945,p3,1
1011,714982300363173890,2016-03-30 01:07:18,"<a href=""http://twitter.com/download/iphone"" rel=""nofollow"">Twitter for iPhone</a>",This is Calbert. He forgot to clear his Google search history. 9/10 rookie mistake Calbert https://t.co/jRm5J3YCmj,9,10,Calbert,None,4023,1133,0.9,ibizan_hound,True,0.00996204,p3,1
1012,714957620017307648,2016-03-29 23:29:14,"<a href=""http://twitter.com/download/iphone"" rel=""nofollow"">Twitter for iPhone</a>",This is Curtis. He's an Albino Haberdasher. Terrified of dandelions. They really spook him up. 10/10 it'll be ok pup https://t.co/s8YcfZrWhK,10,10,Curtis,None,4433,1557,1.0,kuvasz,True,0.129005,p3,1
1013,714631576617938945,2016-03-29 01:53:39,"<a href=""http://twitter.com/download/iphone"" rel=""nofollow"">Twitter for iPhone</a>",This is Benedict. He's a feisty pup. Needs a brushing. Portable af. Looks very angry actually. 4/10 might not pet https://t.co/3oeFfHjv0Z,4,10,Benedict,None,3504,1097,0.4,black-footed_ferret,False,0.0999327,p3,1
1014,714606013974974464,2016-03-29 00:12:05,"<a href=""http://twitter.com/download/iphone"" rel=""nofollow"">Twitter for iPhone</a>",Here are two lil cuddly puppers. Both 12/10 would snug like so much https://t.co/zO4eb7C4tG,12,10,None,None,3878,1023,1.2,golden_retriever,True,0.129643,p3,1
1015,714258258790387713,2016-03-28 01:10:13,"<a href=""http://twitter.com/download/iphone"" rel=""nofollow"">Twitter for iPhone</a>","Meet Travis and Flurp. Travis is pretty chill but Flurp can't lie down properly. 10/10 &amp; 8/10
get it together Flurp https://t.co/Akzl5ynMmE",10,10,Travis,None,3224,791,1.0,beagle,True,0.101294,p3,1
1016,714251586676113411,2016-03-28 00:43:43,"<a href=""http://twitter.com/download/iphone"" rel=""nofollow"">Twitter for iPhone</a>",This is Thumas. He hates potted plants. 8/10 wtf Thumas https://t.co/rDVueNIcEi,8,10,Thumas,None,3501,924,0.8,great_pyrenees,True,0.0114524,p3,2
1017,714214115368108032,2016-03-27 22:14:49,"<a href=""http://twitter.com/download/iphone"" rel=""nofollow"">Twitter for iPhone</a>",Happy Easter from the squad! ðŸ‡ðŸ¶ 13/10 for all https://t.co/YMx4KWJUAB,13,10,None,None,2435,967,1.3,german_shepherd,True,0.046524,p3,1
1018,714141408463036416,2016-03-27 17:25:54,"<a href=""http://twitter.com/download/iphone"" rel=""nofollow"">Twitter for iPhone</a>","I know we only rate dogs, but since it's Easter I guess we could rate a bunny for a change. 10/10 petable as hell https://t.co/O2RlKXigHu",10,10,None,None,4607,1537,1.0,redbone,True,0.00360489,p3,1
1019,713919462244790272,2016-03-27 02:43:58,"<a href=""http://twitter.com/download/iphone"" rel=""nofollow"">Twitter for iPhone</a>",This is Kanu. He's a Freckled Ticonderoga. Simply flawless. 12/10 would perform an elaborate heist to capture https://t.co/7vyAzIURrE,12,10,Kanu,None,3497,853,1.2,malamute,True,0.0979627,p3,1
1020,713900603437621249,2016-03-27 01:29:02,"<a href=""http://twitter.com/download/iphone"" rel=""nofollow"">Twitter for iPhone</a>",Happy Saturday here's 9 puppers on a bench. 99/90 good work everybody https://t.co/mpvaVxKmc1,99,90,None,None,3021,818,1.1,irish_setter,True,0.0927252,p3,1
1021,713761197720473600,2016-03-26 16:15:05,"<a href=""http://twitter.com/download/iphone"" rel=""nofollow"">Twitter for iPhone</a>",This is Piper. She would really like that tennis ball core. Super sneaky tongue slip. 12/10 precious af https://t.co/QP6GHi5az9,12,10,Piper,None,5209,1514,1.2,welsh_springer_spaniel,True,0.0379107,p3,1
1022,713411074226274305,2016-03-25 17:03:49,"<a href=""http://twitter.com/download/iphone"" rel=""nofollow"">Twitter for iPhone</a>",Here we see an extremely rare Bearded Floofmallow. Only a few left in the wild. 11/10 would pet with a purpose https://t.co/jVJJKlPbvq,11,10,None,None,4718,1416,1.1,kuvasz,True,0.122451,p3,1
1023,713177543487135744,2016-03-25 01:35:51,"<a href=""http://twitter.com/download/iphone"" rel=""nofollow"">Twitter for iPhone</a>",This is Lance. Lance doesn't give a shit. 10/10 we should all be more like Lance https://t.co/SqnG9Ap28J,10,10,Lance,None,7723,3120,1.0,great_dane,True,0.0258743,p3,1
1024,713175907180089344,2016-03-25 01:29:21,"<a href=""http://twitter.com/download/iphone"" rel=""nofollow"">Twitter for iPhone</a>",Say hello to Opie and Clarkus. Clarkus fell asleep so Opie buried him. Ruthless af 10/10 for both https://t.co/xT7XaY4gnW,10,10,Opie,None,4773,1598,1.0,siberian_husky,True,0.0284542,p3,1
1025,712809025985978368,2016-03-24 01:11:29,"<a href=""http://twitter.com/download/iphone"" rel=""nofollow"">Twitter for iPhone</a>",This is Stubert. He just arrived. 10/10 https://t.co/HVGs5aAKAn,10,10,Stubert,None,19981,7410,1.0,pug,True,0.00765137,p3,1
1026,712717840512598017,2016-03-23 19:09:09,"<a href=""http://twitter.com/download/iphone"" rel=""nofollow"">Twitter for iPhone</a>",Please don't send in any more polar bears. We only rate dogs. Thank you... 10/10 https://t.co/83RGhdIQz2,10,10,None,None,13259,5478,1.0,irish_wolfhound,True,0.0495237,p3,1
