,tweet_id,timestamp,source,text,rating_numerator,rating_denominator,name,dog_stage,favorite_count,retweet_count,real_rating,class,dog,conf,conf_type,img_num
1514,677673981332312066,2015-12-18 02:17:22,"<a href=""http://twitter.com/download/iphone"" rel=""nofollow"">Twitter for iPhone</a>",Endangered triangular pup here. Could be a wizard. Caught mid-laugh. No legs. Just fluff. Probably a wizard. 9/10 https://t.co/GFVIHIod0Z,9,10,None,None,3565,1642,0.9,pomeranian,True,0.0221842,p3,1
1515,677662372920729601,2015-12-18 01:31:14,"<a href=""http://twitter.com/download/iphone"" rel=""nofollow"">Twitter for iPhone</a>","In honor of the new Star Wars movie. Here's Yoda pug. 12/10 pet really well, would I https://t.co/pvjdRn00XH",12,10,None,None,2088,1072,1.2,cloak,False,0.07143889999999999,p3,1
1516,677644091929329666,2015-12-18 00:18:36,"<a href=""http://twitter.com/download/iphone"" rel=""nofollow"">Twitter for iPhone</a>",This is a dog swinging. I really enjoyed it so I hope you all do as well. 11/10 https://t.co/Ozo9KHTRND,11,10,None,None,2008,873,1.1,swing,False,0.0598404,p3,1
1517,677573743309385728,2015-12-17 19:39:03,"<a href=""http://twitter.com/download/iphone"" rel=""nofollow"">Twitter for iPhone</a>",This is Sandy. He's sexually confused. Thinks he's a pigeon. Also an All-American cheese catcher. 10/10 so petable https://t.co/Htu8plSqEu,10,10,Sandy,None,2279,806,1.0,parallel_bars,False,0.034796499999999994,p3,2
1518,677565715327688705,2015-12-17 19:07:09,"<a href=""http://twitter.com/download/iphone"" rel=""nofollow"">Twitter for iPhone</a>",Contortionist pup here. Inside pentagram. Clearly worships Satan. Known to slowly push fragile stuff off tables 6/10 https://t.co/EX9oR55VMe,6,10,None,None,1379,505,0.6,purse,False,0.105641,p3,1
1519,677557565589463040,2015-12-17 18:34:46,"<a href=""http://twitter.com/download/iphone"" rel=""nofollow"">Twitter for iPhone</a>",Reckless pupper here. Not even looking at road. Absolute menace. No regard for fellow pupper lives. 10/10 still cute https://t.co/96IBkOYB7j,10,10,None,pupper,2610,1283,1.0,pekinese,True,0.209213,p3,1
1520,677547928504967168,2015-12-17 17:56:29,"<a href=""http://twitter.com/download/iphone"" rel=""nofollow"">Twitter for iPhone</a>",Not much to say here. I just think everyone needs to see this. 12/10 https://t.co/AGag0hFHpe,12,10,None,None,7423,3984,1.2,boxer,True,0.000461663,p3,1
1521,677530072887205888,2015-12-17 16:45:31,"<a href=""http://twitter.com/download/iphone"" rel=""nofollow"">Twitter for iPhone</a>",Say hello to Axel. He's a Black Chevy Pinot on wheels. 0 to 60 in 5.7 seconds (if downhill). 9/10 I call shotgun https://t.co/DKe9DBnnHE,9,10,Axel,None,1135,246,0.9,american_staffordshire_terrier,True,0.0230747,p3,1
1522,677334615166730240,2015-12-17 03:48:51,"<a href=""http://twitter.com/download/iphone"" rel=""nofollow"">Twitter for iPhone</a>",This dog gave up mid jump. 9/10 https://t.co/KmMv3Y2zI8,9,10,None,None,1450,324,0.9,irish_water_spaniel,True,0.0495306,p3,2
1523,677331501395156992,2015-12-17 03:36:28,"<a href=""http://twitter.com/download/iphone"" rel=""nofollow"">Twitter for iPhone</a>",Meet Humphrey. He's a Northern Polyp Viagra. One ear works. Face stuck like that. Always surprised. 9/10 petable af https://t.co/FS7eJQM2F4,9,10,Humphrey,None,1163,261,0.9,french_bulldog,True,0.106462,p3,1
1524,677328882937298944,2015-12-17 03:26:04,"<a href=""http://twitter.com/download/iphone"" rel=""nofollow"">Twitter for iPhone</a>",This is Derek. All the dogs adore Derek. He's a great guy. 10/10 really solid pup https://t.co/KgcsGNb61s,10,10,Derek,None,3875,1646,1.0,staffordshire_bullterrier,True,0.0284697,p3,1
1525,677314812125323265,2015-12-17 02:30:09,"<a href=""http://twitter.com/download/iphone"" rel=""nofollow"">Twitter for iPhone</a>","Meet Tassy &amp; Bee. Tassy is pretty chill, but Bee is convinced the Ruffles are haunted. 10/10 &amp; 11/10 respectively https://t.co/fgORpmTN9C",10,10,Tassy,None,1757,594,1.0,chihuahua,True,0.00820404,p3,2
1526,677301033169788928,2015-12-17 01:35:24,"<a href=""http://twitter.com/download/iphone"" rel=""nofollow"">Twitter for iPhone</a>",This is Juckson. He's totally on his way to a nascar race. 5/10 for Juckson https://t.co/IoLRvF0Kak,5,10,Juckson,None,1331,455,0.5,chihuahua,True,0.11972,p3,1
1527,677269281705472000,2015-12-16 23:29:14,"<a href=""http://twitter.com/download/iphone"" rel=""nofollow"">Twitter for iPhone</a>",This is the happiest pupper I've ever seen. 10/10 would trade lives with https://t.co/ep8ATEJwRb,10,10,None,pupper,2121,776,1.0,german_shepherd,True,0.0131032,p3,1
1528,677228873407442944,2015-12-16 20:48:40,"<a href=""http://twitter.com/download/iphone"" rel=""nofollow"">Twitter for iPhone</a>",Say hello to Chuq. He just wants to fit in. 11/10 https://t.co/hGkMCjZzn4,11,10,Chuq,None,3779,1798,1.1,green_lizard,False,0.0449758,p3,1
1529,677187300187611136,2015-12-16 18:03:28,"<a href=""http://twitter.com/download/iphone"" rel=""nofollow"">Twitter for iPhone</a>",Here we see a Byzantine Rigatoni. Very aerodynamic. No eyes. Actually not windy here they just look like that. 9/10 https://t.co/gzI0m6wXRo,9,10,None,None,2916,1007,0.9,old_english_sheepdog,True,0.059538,p3,1
1530,676975532580409345,2015-12-16 04:01:59,"<a href=""http://twitter.com/download/iphone"" rel=""nofollow"">Twitter for iPhone</a>",This is Cooper. He doesn't know how cheese works. Likes the way it feels on his face. Cheeky tongue slip. 11/10 https://t.co/j1zczS0lI5,11,10,Cooper,None,2955,1176,1.1,eskimo_dog,True,0.125547,p3,1
1531,676957860086095872,2015-12-16 02:51:45,"<a href=""http://twitter.com/download/iphone"" rel=""nofollow"">Twitter for iPhone</a>",10/10 I'd follow this dog into battle no questions asked https://t.co/ngTNXYQF0L,10,10,None,None,2345,889,1.0,golden_retriever,True,0.0311519,p3,1
1532,676949632774234114,2015-12-16 02:19:04,"<a href=""http://twitter.com/download/iphone"" rel=""nofollow"">Twitter for iPhone</a>",This is Tyrus. He's a Speckled Centennial Ticonderoga. Terrified of floating red ball. Nifty bandana. 8/10 v petable https://t.co/HqM3YhCaaa,8,10,Tyrus,None,1382,432,0.8,boxer,True,0.114606,p3,1
1533,676948236477857792,2015-12-16 02:13:31,"<a href=""http://twitter.com/download/iphone"" rel=""nofollow"">Twitter for iPhone</a>",This is Karl. Karl thinks he's slick. 6/10 sneaky pup https://t.co/Lo4ALwjVh4,6,10,Karl,None,2312,959,0.6,squirrel_monkey,False,0.08324730000000001,p3,1
1534,676946864479084545,2015-12-16 02:08:04,"<a href=""http://twitter.com/download/iphone"" rel=""nofollow"">Twitter for iPhone</a>",This pups goal was to get all four feet as close to each other as possible. Valiant effort 12/10 https://t.co/2mXALbgBTV,12,10,None,None,1815,416,1.2,great_pyrenees,True,0.041017800000000014,p3,1
1535,676942428000112642,2015-12-16 01:50:26,"<a href=""http://twitter.com/download/iphone"" rel=""nofollow"">Twitter for iPhone</a>",Who leaves the last cupcake just sitting there? 9/10 https://t.co/PWMqAoEx2a,9,10,None,None,2215,842,0.9,weasel,False,0.0976255,p3,1
1536,676936541936185344,2015-12-16 01:27:03,"<a href=""http://twitter.com/download/iphone"" rel=""nofollow"">Twitter for iPhone</a>",Here we see a rare pouched pupper. Ample storage space. Looks alert. Jumps at random. Kicked open that door. 8/10 https://t.co/mqvaxleHRz,8,10,None,pupper,13554,5395,0.8,space_heater,False,0.0473911,p3,1
1537,676897532954456065,2015-12-15 22:52:02,"<a href=""http://twitter.com/download/iphone"" rel=""nofollow"">Twitter for iPhone</a>",Exotic handheld dog here. Appears unathletic. Feet look deadly. Can be thrown a great distance. 5/10 might pet idk https://t.co/Avq4awulqk,5,10,None,None,2389,799,0.5,macaque,False,0.0130582,p3,1
1538,676864501615042560,2015-12-15 20:40:47,"<a href=""http://twitter.com/download/iphone"" rel=""nofollow"">Twitter for iPhone</a>",Meet Ash. He's just a head now. Lost his body during the Third Crusade. Still in good spirits. 10/10 would pet well https://t.co/NJj2uP0atK,10,10,Ash,None,2238,784,1.0,weimaraner,True,0.0489679,p3,1
1539,676821958043033607,2015-12-15 17:51:44,"<a href=""http://twitter.com/download/iphone"" rel=""nofollow"">Twitter for iPhone</a>",Finally some constructive political change in this country. 11/10 https://t.co/mvQaETHVSb,11,10,None,None,24631,17143,1.1,standard_poodle,True,0.013263,p3,2
1540,676819651066732545,2015-12-15 17:42:34,"<a href=""http://twitter.com/download/iphone"" rel=""nofollow"">Twitter for iPhone</a>",Watch out Airbud. This pupper is also good at the sports. 12/10 I'm thinking D1 https://t.co/1HrFdo7M0C,12,10,None,pupper,1916,725,1.2,labrador_retriever,True,0.0394646,p3,2
1541,676811746707918848,2015-12-15 17:11:09,"<a href=""http://twitter.com/download/iphone"" rel=""nofollow"">Twitter for iPhone</a>",Say hello to Penny &amp; Gizmo. They are practicing their caroling. The ambition in the room is tangible. 9/10 for both https://t.co/aqBHjjh5VD,9,10,Penny,None,1508,463,0.9,cocker_spaniel,True,0.0603312,p3,1
1542,676776431406465024,2015-12-15 14:50:49,"<a href=""http://twitter.com/download/iphone"" rel=""nofollow"">Twitter for iPhone</a>","When someone yells ""cops!"" at a party and you gotta get your drunk friend out of there. 10/10 https://t.co/4rMZi5Ca1k",10,10,None,None,5302,2198,1.0,microwave,False,0.038110000000000005,p3,1
1543,676617503762681856,2015-12-15 04:19:18,"<a href=""http://twitter.com/download/iphone"" rel=""nofollow"">Twitter for iPhone</a>",I promise this wasn't meant to be a cuteness overload account but ermergerd look at this cozy pupper. 13/10 https://t.co/mpQl2rJjDh,13,10,None,pupper,3084,1084,1.3,pekinese,True,0.00660034,p3,1
1544,676613908052996102,2015-12-15 04:05:01,"<a href=""http://twitter.com/download/iphone"" rel=""nofollow"">Twitter for iPhone</a>",This is the saddest/sweetest/best picture I've been sent. 12/10 ðŸ˜¢ðŸ¶ https://t.co/vQ2Lw1BLBF,12,10,None,None,1158,212,1.2,miniature_pinscher,True,0.07064669999999999,p3,1
1545,676606785097199616,2015-12-15 03:36:42,"<a href=""http://twitter.com/download/iphone"" rel=""nofollow"">Twitter for iPhone</a>",*screeches for a sec and then faints* 12/10 https://t.co/N5QL4ySBEx,12,10,None,None,2002,483,1.2,malinois,True,0.1423,p3,1
1546,676603393314578432,2015-12-15 03:23:14,"<a href=""http://twitter.com/download/iphone"" rel=""nofollow"">Twitter for iPhone</a>",This is Godzilla pupper. He had a ruff childhood &amp; now deflects that pain outward by terrorizing cities. Tragic 9/10 https://t.co/g1tLGkyaxr,9,10,Godzilla,pupper,1251,431,0.9,boxer,True,0.028404,p3,1
1547,676588346097852417,2015-12-15 02:23:26,"<a href=""http://twitter.com/download/iphone"" rel=""nofollow"">Twitter for iPhone</a>",This is Bubbles. He kinda resembles a fish. Always makes eye contact with u no matter what. Sneaky tongue slip. 5/10 https://t.co/Nrhvc5tLFT,5,10,Bubbles,None,2482,872,0.5,chihuahua,True,0.00230192,p3,1
1548,676582956622721024,2015-12-15 02:02:01,"<a href=""http://twitter.com/download/iphone"" rel=""nofollow"">Twitter for iPhone</a>","Meet Vinnie. He's having fun while being safe. Well not a lot of fun, but definitely safe, and that's important 8/10 https://t.co/vZYtynZZlH",8,10,Vinnie,None,1285,308,0.8,french_bulldog,True,0.0124289,p3,1
1549,676575501977128964,2015-12-15 01:32:24,"<a href=""http://twitter.com/download/iphone"" rel=""nofollow"">Twitter for iPhone</a>",This pupper is very passionate about Christmas. Wanted to give the tree a hug. So cute. 8/10 https://t.co/NsGyECJuq7,8,10,None,pupper,2756,1232,0.8,shetland_sheepdog,True,0.0575976,p3,1
1550,676533798876651520,2015-12-14 22:46:41,"<a href=""http://twitter.com/download/iphone"" rel=""nofollow"">Twitter for iPhone</a>",ITSOFLUFFAYYYYY 12/10 https://t.co/bfw13CnuuZ,12,10,None,None,1994,607,1.2,fur_coat,False,0.117506,p3,1
1551,676496375194980353,2015-12-14 20:17:59,"<a href=""http://twitter.com/download/iphone"" rel=""nofollow"">Twitter for iPhone</a>",Say hello to Griffin. He's upset because his costume for Halloween didn't arrive until today. 9/10 cheer up pup https://t.co/eoBCjSFajX,9,10,Griffin,None,1604,585,0.9,french_bulldog,True,0.00389287,p3,1
1552,676470639084101634,2015-12-14 18:35:43,"<a href=""http://twitter.com/download/iphone"" rel=""nofollow"">Twitter for iPhone</a>",Three generations of pupper. 11/10 for all https://t.co/tAmQYvzrau,11,10,None,pupper,12396,5114,1.1,dingo,False,0.0153434,p3,1
1553,676440007570247681,2015-12-14 16:34:00,"<a href=""http://twitter.com/download/iphone"" rel=""nofollow"">Twitter for iPhone</a>",Hope your Monday isn't too awful. Here's two baseball puppers. 11/10 for each https://t.co/dB0H9hdZai,11,10,None,None,1826,734,1.1,shih-tzu,True,0.0943966,p3,2
1554,676430933382295552,2015-12-14 15:57:56,"<a href=""http://twitter.com/download/iphone"" rel=""nofollow"">Twitter for iPhone</a>","Meet Duke. He's an Urban Parmesan. They know he's scared of the green rubber dog. ""Why u do dis?"" thinks Duke. 10/10 https://t.co/3bim9U5Idr",10,10,Duke,None,1481,377,1.0,labrador_retriever,True,0.0361217,p3,1
1555,676263575653122048,2015-12-14 04:52:55,"<a href=""http://twitter.com/download/iphone"" rel=""nofollow"">Twitter for iPhone</a>",All this pupper wanted to do was go skiing. No one told him about the El NiÃ±o. Poor pupper. 10/10 maybe next year https://t.co/fTgbq1UBR9,10,10,None,pupper,2197,594,1.0,shopping_basket,False,0.07785210000000001,p3,1
1556,676237365392908289,2015-12-14 03:08:46,"<a href=""http://twitter.com/download/iphone"" rel=""nofollow"">Twitter for iPhone</a>",Say hello to Winston. He has no respect for the system. Much rebellion. I think that's a palm tree... nice. 8/10 https://t.co/dOLQddhXLZ,8,10,Winston,None,1300,326,0.8,boston_bull,True,0.00691629,p3,1
1557,676219687039057920,2015-12-14 01:58:31,"<a href=""http://twitter.com/download/iphone"" rel=""nofollow"">Twitter for iPhone</a>",This is Kenneth. He's stuck in a bubble. 10/10 hang in there Kenneth https://t.co/uQt37xlYMJ,10,10,Kenneth,None,79114,33897,1.0,whippet,True,0.000132464,p3,1
1558,676215927814406144,2015-12-14 01:43:35,"<a href=""http://twitter.com/download/iphone"" rel=""nofollow"">Twitter for iPhone</a>",This is Herm. He just wants to be like the other dogs. Sneaky tongue slip. Super fuzzy. 9/10 would cuddle firmly https://t.co/tg8h9lzCHv,9,10,Herm,None,1847,645,0.9,broccoli,False,6.0911000000000014e-05,p3,1
1559,676191832485810177,2015-12-14 00:07:50,"<a href=""http://twitter.com/download/iphone"" rel=""nofollow"">Twitter for iPhone</a>",These two pups just met and have instantly bonded. Spectacular scene. Mesmerizing af. 10/10 and 7/10 for blue dog https://t.co/gwryaJO4tC,10,10,None,None,2419,1121,1.0,muzzle,False,0.07148510000000001,p3,2
1560,676146341966438401,2015-12-13 21:07:04,"<a href=""http://twitter.com/download/iphone"" rel=""nofollow"">Twitter for iPhone</a>",This is Bert. He likes flowers. 10/10 https://t.co/lmQRrNxaQu,10,10,Bert,None,2042,726,1.0,greenhouse,False,0.0348681,p3,1
1561,676101918813499392,2015-12-13 18:10:33,"<a href=""http://twitter.com/download/iphone"" rel=""nofollow"">Twitter for iPhone</a>",Meet Striker. He's ready for Christmas. 11/10 https://t.co/B3xxSLjQSH,11,10,Striker,None,2976,1259,1.1,irish_terrier,True,0.10698699999999997,p3,1
1562,676098748976615425,2015-12-13 17:57:57,"<a href=""http://twitter.com/download/iphone"" rel=""nofollow"">Twitter for iPhone</a>",Extremely rare pup here. Very religious. Always praying. Too many legs. Not overwhelmingly fluffy. Won't bark. 3/10 https://t.co/REyE5YKVBb,3,10,None,None,3203,1569,0.3,purse,False,0.0814119,p3,1
1563,676089483918516224,2015-12-13 17:21:08,"<a href=""http://twitter.com/download/iphone"" rel=""nofollow"">Twitter for iPhone</a>","""Yes hello I'ma just snag this here toasted bagel real quick. carry on."" 9/10 https://t.co/Cuz0Osnekp",9,10,None,None,1399,468,0.9,american_staffordshire_terrier,True,0.0423353,p3,1
1564,675898130735476737,2015-12-13 04:40:46,"<a href=""http://twitter.com/download/iphone"" rel=""nofollow"">Twitter for iPhone</a>",I'm sure you've all seen this pupper. Not prepared at all for the flying disc of terror. 10/10 https://t.co/G0pQiFGM7O,10,10,None,pupper,1741,635,1.0,pug,True,0.0745973,p3,1
1565,675891555769696257,2015-12-13 04:14:39,"<a href=""http://twitter.com/download/iphone"" rel=""nofollow"">Twitter for iPhone</a>",This is Donny. He's summoning the demon monster Babadook. 6/10 Donny please no that won't be a good time for anyone https://t.co/kiW6Knb7Gp,6,10,Donny,None,2261,952,0.6,great_dane,True,0.117806,p3,1
1566,675888385639251968,2015-12-13 04:02:03,"<a href=""http://twitter.com/download/iphone"" rel=""nofollow"">Twitter for iPhone</a>",Breathtaking scene. A father taking care of his newborn pup. Tugs at the heartstrings. 10/10 restores my faith https://t.co/06oZdehGEa,10,10,None,None,2531,1044,1.0,komondor,True,0.023141400000000003,p3,1
1567,675878199931371520,2015-12-13 03:21:34,"<a href=""http://twitter.com/download/iphone"" rel=""nofollow"">Twitter for iPhone</a>","Ok, I'll admit this is a pretty adorable bunny hopping towards the ocean but please only send in dogs... 11/10 https://t.co/sfsVCGIipI",11,10,None,None,4435,1538,1.1,cardigan,True,0.0436271,p3,1
1568,675870721063669760,2015-12-13 02:51:51,"<a href=""http://twitter.com/download/iphone"" rel=""nofollow"">Twitter for iPhone</a>",&amp; this is Yoshi. Another world record contender 11/10 (what the hell is happening why are there so many contenders?) https://t.co/QG708dDNH6,11,10,None,None,1744,618,1.1,beagle,True,0.182241,p3,1
1569,675853064436391936,2015-12-13 01:41:41,"<a href=""http://twitter.com/download/iphone"" rel=""nofollow"">Twitter for iPhone</a>",Here we have an entire platoon of puppers. Total score: 88/80 would pet all at once https://t.co/y93p6FLvVw,88,80,None,None,2857,1420,1.1,vizsla,True,0.0282072,p3,1
1570,675845657354215424,2015-12-13 01:12:15,"<a href=""http://twitter.com/download/iphone"" rel=""nofollow"">Twitter for iPhone</a>","This is Pepper. She's not fully comfortable riding her imaginary bike yet. 10/10 don't worry pupper, it gets easier https://t.co/40dj4eTsXG",10,10,Pepper,pupper,2427,972,1.0,french_bulldog,True,0.00983981,p3,1
1571,675822767435051008,2015-12-12 23:41:18,"<a href=""http://twitter.com/download/iphone"" rel=""nofollow"">Twitter for iPhone</a>",ðŸŽ¶ HELLO FROM THE OTHER SIIIIIIIIDE ðŸŽ¶ 10/10s https://t.co/GK2HJtkdQk,10,10,None,None,1619,578,1.0,pekinese,True,0.133266,p3,1
1572,675820929667219457,2015-12-12 23:34:00,"<a href=""http://twitter.com/download/iphone"" rel=""nofollow"">Twitter for iPhone</a>",Here's a handful of sleepy puppers. All look unaware of their surroundings. Lousy guard dogs. Still cute tho 11/10s https://t.co/lyXX3v5j4s,11,10,None,None,1113,252,1.1,bloodhound,True,0.110848,p3,1
1573,675798442703122432,2015-12-12 22:04:39,"<a href=""http://twitter.com/download/iphone"" rel=""nofollow"">Twitter for iPhone</a>",This is Bernie. He just touched a boob for the first time. 10/10 https://t.co/whQKMygnK6,10,10,Bernie,None,10880,3692,1.0,boxer,True,0.0803982,p3,1
1574,675781562965868544,2015-12-12 20:57:34,"<a href=""http://twitter.com/download/iphone"" rel=""nofollow"">Twitter for iPhone</a>",Say hello to Buddah. He was Waldo for Halloween. 11/10 https://t.co/DVAqAnb624,11,10,Buddah,None,1710,518,1.1,toy_poodle,True,0.0135554,p3,1
1575,675740360753160193,2015-12-12 18:13:51,"<a href=""http://twitter.com/download/iphone"" rel=""nofollow"">Twitter for iPhone</a>",Here's a pupper licking in slow motion. 12/10 please enjoy https://t.co/AUJi8ujxw9,12,10,None,pupper,1233,379,1.2,saluki,True,0.0684146,p3,1
1576,675710890956750848,2015-12-12 16:16:45,"<a href=""http://twitter.com/download/iphone"" rel=""nofollow"">Twitter for iPhone</a>",This is Lenny. He was just told that he couldn't explore the fish tank. 12/10 smh all that work for nothing https://t.co/JWi6YrpiO1,12,10,Lenny,None,2006,902,1.2,sealyham_terrier,True,0.164967,p3,2
1577,675707330206547968,2015-12-12 16:02:36,"<a href=""http://twitter.com/download/iphone"" rel=""nofollow"">Twitter for iPhone</a>",We've got ourselves a battle here. Watch out Reggie. 11/10 https://t.co/ALJvbtcwf0,11,10,None,None,2106,753,1.1,bagel,False,0.035701599999999986,p3,1
1578,675706639471788032,2015-12-12 15:59:51,"<a href=""http://twitter.com/download/iphone"" rel=""nofollow"">Twitter for iPhone</a>",This is a Sizzlin Menorah spaniel from Brooklyn named Wylie. Lovable eyes. Chiller as hell. 10/10 and I'm out.. poof https://t.co/7E0AiJXPmI,10,10,None,None,681,104,1.0,cocker_spaniel,True,0.00201378,p3,1
1579,675534494439489536,2015-12-12 04:35:48,"<a href=""http://twitter.com/download/iphone"" rel=""nofollow"">Twitter for iPhone</a>",Seriously guys?! Only send in dogs. I only rate dogs. This is a baby black bear... 11/10 https://t.co/H7kpabTfLj,11,10,None,None,1910,454,1.1,newfoundland,True,0.0499138,p3,1
1580,675531475945709568,2015-12-12 04:23:49,"<a href=""http://twitter.com/download/iphone"" rel=""nofollow"">Twitter for iPhone</a>",This is Ellie AKA Queen Slayer of the Orbs. Very self-motivated. Great yard. Rad foliage. 10/10 would pet diligently https://t.co/c9jmg3Xtzn,10,10,Ellie,None,1247,421,1.0,siberian_husky,True,0.020221,p3,1
1581,675522403582218240,2015-12-12 03:47:46,"<a href=""http://twitter.com/download/iphone"" rel=""nofollow"">Twitter for iPhone</a>",Meet Sammy. He's a Motorola Firefox. Hat under hoodie (must be a half-decent up and coming white rapper) 10/10 https://t.co/rO2zxf0OQ0,10,10,Sammy,None,1099,308,1.0,irish_setter,True,0.0803233,p3,1
1582,675517828909424640,2015-12-12 03:29:35,"<a href=""http://twitter.com/download/iphone"" rel=""nofollow"">Twitter for iPhone</a>",12/10 stay woke https://t.co/XDiQw4Akiw,12,10,None,None,1384,495,1.2,flat-coated_retriever,True,0.0908994,p3,1
1583,675501075957489664,2015-12-12 02:23:01,"<a href=""http://twitter.com/download/iphone"" rel=""nofollow"">Twitter for iPhone</a>","I shall call him squishy and he shall be mine, and he shall be my squishy. 13/10 https://t.co/WId5lxNdPH",13,10,None,None,18168,6332,1.3,french_loaf,False,0.0181889,p3,1
1584,675497103322386432,2015-12-12 02:07:14,"<a href=""http://twitter.com/download/iphone"" rel=""nofollow"">Twitter for iPhone</a>",Meet Reggie. He's going for the world record. Must concentrate. Focus up pup. 11/10 we all believe in you Reggie https://t.co/h3AWz4AzuC,11,10,Reggie,None,3321,1418,1.1,rhodesian_ridgeback,True,0.0614913,p3,1
1585,675489971617296384,2015-12-12 01:38:53,"<a href=""http://twitter.com/download/iphone"" rel=""nofollow"">Twitter for iPhone</a>",RT until we find this dog. Clearly a cool dog (front leg relaxed out window). Looks to be a superb driver. 10/10 https://t.co/MnTrKaQ8Wn,10,10,None,None,1372,649,1.0,old_english_sheepdog,True,0.0939522,p3,1
1586,675483430902214656,2015-12-12 01:12:54,"<a href=""http://twitter.com/download/iphone"" rel=""nofollow"">Twitter for iPhone</a>",Rare shielded battle dog here. Very happy about abundance of lettuce. Painfully slow fetcher. Still petable. 5/10 https://t.co/C3tlKVq7eO,5,10,None,None,1952,1057,0.5,loggerhead,False,0.0711215,p3,1
1587,675432746517426176,2015-12-11 21:51:30,"<a href=""http://twitter.com/download/iphone"" rel=""nofollow"">Twitter for iPhone</a>",Happy Friday. Here's some golden puppers. 12/10 for all https://t.co/wNkqAED6lG,12,10,None,None,1600,615,1.2,chihuahua,True,0.000693528,p3,1
1588,675372240448454658,2015-12-11 17:51:04,"<a href=""http://twitter.com/download/iphone"" rel=""nofollow"">Twitter for iPhone</a>","The tail alone is 13/10. Great dog, better owner https://t.co/IyAXinfyju",13,10,None,None,1800,548,1.3,samoyed,True,0.0872995,p3,1
1589,675362609739206656,2015-12-11 17:12:48,"<a href=""http://twitter.com/download/iphone"" rel=""nofollow"">Twitter for iPhone</a>",This is Daisy. She loves that shoe. Still no seat belt. Super churlish. 12/10 the dogs are killing it today https://t.co/cZlkvgRPdn,12,10,Daisy,None,1110,253,1.2,kuvasz,True,0.13991099999999998,p3,1
1590,675354435921575936,2015-12-11 16:40:19,"<a href=""http://twitter.com"" rel=""nofollow"">Twitter Web Client</a>",Everyone needs to watch this. 13/10 https://t.co/Bb3xnpsWBC,13,10,None,None,34629,18594,1.3,brittany_spaniel,True,0.16208399999999998,p3,1
1591,675349384339542016,2015-12-11 16:20:15,"<a href=""http://twitter.com/download/iphone"" rel=""nofollow"">Twitter for iPhone</a>",Yea I lied. Here's more. All 13/10 https://t.co/ZQZf2U4xCP,13,10,None,None,4164,2465,1.3,irish_wolfhound,True,0.00401972,p3,3
1592,675334060156301312,2015-12-11 15:19:21,"<a href=""http://twitter.com/download/iphone"" rel=""nofollow"">Twitter for iPhone</a>",Good morning here's a grass pupper. 12/10 https://t.co/2d68FmWGGs,12,10,None,pupper,2944,1402,1.2,chow,True,0.0390362,p3,2
1593,675166823650848770,2015-12-11 04:14:49,"<a href=""http://twitter.com/download/iphone"" rel=""nofollow"">Twitter for iPhone</a>",This is Arnold. He broke his leg saving a handicapped child from a forest fire. True hero. 10/10 inspirational dog https://t.co/bijCeHeX4C,10,10,Arnold,None,3824,1749,1.0,teddy,False,0.127975,p3,1
1594,675153376133427200,2015-12-11 03:21:23,"<a href=""http://twitter.com/download/iphone"" rel=""nofollow"">Twitter for iPhone</a>",What kind of person sends in a picture without a dog in it? 1/10 just because that's a nice table https://t.co/RDXCfk8hK0,1,10,None,None,6660,2831,0.1,seat_belt,False,0.034995099999999994,p3,1
1595,675149409102012420,2015-12-11 03:05:37,"<a href=""http://twitter.com/download/iphone"" rel=""nofollow"">Twitter for iPhone</a>",holy shit 12/10 https://t.co/p6O8X93bTQ,12,10,None,None,3955,1829,1.2,tibetan_terrier,True,2.87785e-05,p3,1
1596,675147105808306176,2015-12-11 02:56:28,"<a href=""http://twitter.com/download/iphone"" rel=""nofollow"">Twitter for iPhone</a>",When you're presenting a group project and the 4th guy tells the teacher that he did all the work. 10/10 https://t.co/f50mbB4UWS,10,10,None,None,998,261,1.0,flat-coated_retriever,True,0.0106373,p3,1
