,tweet_id,timestamp,source,text,rating_numerator,rating_denominator,name,dog_stage,favorite_count,retweet_count,real_rating,class,dog,conf,conf_type,img_num
0,892420643555336193,2017-08-01 16:23:56,"<a href=""http://twitter.com/download/iphone"" rel=""nofollow"">Twitter for iPhone</a>",This is Phineas. He's a mystical boy. Only ever appears in the hole of a donut. 13/10 https://t.co/MgUWQ76dJU,13,10,Phineas,None,38995,8653,1.3,banana,False,0.07611,p3,1
1,892420643555336193,2017-08-01 16:23:56,"<a href=""http://twitter.com/download/iphone"" rel=""nofollow"">Twitter for iPhone</a>",This is Phineas. He's a mystical boy. Only ever appears in the hole of a donut. 13/10 https://t.co/MgUWQ76dJU,13,10,Phineas,None,38995,8653,1.3,banana,False,0.07611,p3,1
2,892177421306343426,2017-08-01 00:17:27,"<a href=""http://twitter.com/download/iphone"" rel=""nofollow"">Twitter for iPhone</a>","This is Tilly. She's just checking pup on you. Hopes you're doing ok. If not, she's available for pats, snugs, boops, the whole bit. 13/10 https://t.co/0Xxu71qeIV",13,10,Tilly,None,33390,6355,1.3,papillon,True,0.0689569,p3,1
3,892177421306343426,2017-08-01 00:17:27,"<a href=""http://twitter.com/download/iphone"" rel=""nofollow"">Twitter for iPhone</a>","This is Tilly. She's just checking pup on you. Hopes you're doing ok. If not, she's available for pats, snugs, boops, the whole bit. 13/10 https://t.co/0Xxu71qeIV",13,10,Tilly,None,33390,6355,1.3,papillon,True,0.0689569,p3,1
4,891815181378084864,2017-07-31 00:18:03,"<a href=""http://twitter.com/download/iphone"" rel=""nofollow"">Twitter for iPhone</a>",This is Archie. He is a rare Norwegian Pouncing Corgo. Lives in the tall grass. You never know when one may strike. 12/10 https://t.co/wUnZnhtVJB,12,10,Archie,None,25168,4220,1.2,kelpie,True,0.0313789,p3,1
5,891689557279858688,2017-07-30 15:58:51,"<a href=""http://twitter.com/download/iphone"" rel=""nofollow"">Twitter for iPhone</a>",This is Darla. She commenced a snooze mid meal. 13/10 happens to the best of us https://t.co/tD36da7qLQ,13,10,Darla,None,42347,8768,1.3,spatula,False,0.0408359,p3,1
6,891327558926688256,2017-07-29 16:00:24,"<a href=""http://twitter.com/download/iphone"" rel=""nofollow"">Twitter for iPhone</a>","This is Franklin. He would like you to stop calling him ""cute."" He is a very fierce shark and should be respected as such. 12/10 #BarkWeek https://t.co/AtUZn91f7f",12,10,Franklin,None,40515,9531,1.2,german_short-haired_pointer,True,0.175219,p3,2
7,891087950875897856,2017-07-29 00:08:17,"<a href=""http://twitter.com/download/iphone"" rel=""nofollow"">Twitter for iPhone</a>",Here we have a majestic great white breaching off South Africa's coast. Absolutely h*ckin breathtaking. 13/10 (IG: tucker_marlo) #BarkWeek https://t.co/kQ04fDDRmh,13,10,None,None,20319,3161,1.3,indian_elephant,False,0.07690219999999999,p3,1
8,890971913173991426,2017-07-28 16:27:12,"<a href=""http://twitter.com/download/iphone"" rel=""nofollow"">Twitter for iPhone</a>","Meet Jax. He enjoys ice cream so much he gets nervous around it. 13/10 help Jax enjoy more things by clicking below

https://t.co/Zr4hWfAs1H https://t.co/tVJBRMnhxl",13,10,Jax,None,11911,2106,1.3,ice_lolly,False,0.193548,p3,1
9,890729181411237888,2017-07-28 00:22:40,"<a href=""http://twitter.com/download/iphone"" rel=""nofollow"">Twitter for iPhone</a>",When you watch your owner call another dog a good boy but then they turn back to you and say you're a great boy. 13/10 https://t.co/v0nONBcwxq,13,10,None,None,65889,19182,1.3,pembroke,True,0.0765069,p3,2
10,890609185150312448,2017-07-27 16:25:51,"<a href=""http://twitter.com/download/iphone"" rel=""nofollow"">Twitter for iPhone</a>",This is Zoey. She doesn't want to be one of the scary sharks. Just wants to be a snuggly pettable boatpet. 13/10 #BarkWeek https://t.co/9TwLuAGH0b,13,10,Zoey,None,27909,4323,1.3,chesapeake_bay_retriever,True,0.118184,p3,1
11,890240255349198849,2017-07-26 15:59:51,"<a href=""http://twitter.com/download/iphone"" rel=""nofollow"">Twitter for iPhone</a>",This is Cassie. She is a college pup. Studying international doggo communication and stick theory. 14/10 so elegant much sophisticate https://t.co/t1bfwz5S2A,14,10,Cassie,doggo,32094,7533,1.4,chihuahua,True,0.0292482,p3,1
12,890006608113172480,2017-07-26 00:31:25,"<a href=""http://twitter.com/download/iphone"" rel=""nofollow"">Twitter for iPhone</a>",This is Koda. He is a South Australian deckshark. Deceptively deadly. Frighteningly majestic. 13/10 would risk a petting #BarkWeek https://t.co/dVPW0B0Mme,13,10,Koda,None,30794,7442,1.3,chow,True,0.00816748,p3,1
13,889880896479866881,2017-07-25 16:11:53,"<a href=""http://twitter.com/download/iphone"" rel=""nofollow"">Twitter for iPhone</a>",This is Bruno. He is a service shark. Only gets out of the water to assist you. 13/10 terrifyingly good boy https://t.co/u1XPQMl29g,13,10,Bruno,None,27928,5039,1.3,muzzle,False,0.0829811,p3,1
14,889665388333682689,2017-07-25 01:55:32,"<a href=""http://twitter.com/download/iphone"" rel=""nofollow"">Twitter for iPhone</a>",Here's a puppo that seems to be on the fence about something haha no but seriously someone help her. 13/10 https://t.co/BxvuXk0UCm,13,10,None,puppo,48304,10203,1.3,basenji,True,0.00463323,p3,1
15,889638837579907072,2017-07-25 00:10:02,"<a href=""http://twitter.com/download/iphone"" rel=""nofollow"">Twitter for iPhone</a>",This is Ted. He does his best. Sometimes that's not enough. But it's ok. 12/10 would assist https://t.co/f8dEDcrKSR,12,10,Ted,None,27318,4608,1.2,staffordshire_bullterrier,True,0.00149818,p3,1
16,889531135344209921,2017-07-24 17:02:04,"<a href=""http://twitter.com/download/iphone"" rel=""nofollow"">Twitter for iPhone</a>",This is Stuart. He's sporting his favorite fanny pack. Secretly filled with bones only. 13/10 puppared puppo #BarkWeek https://t.co/y70o6h3isq,13,10,Stuart,puppo,15163,2263,1.3,redbone,True,0.00795775,p3,1
17,889278841981685760,2017-07-24 00:19:32,"<a href=""http://twitter.com/download/iphone"" rel=""nofollow"">Twitter for iPhone</a>",This is Oliver. You're witnessing one of his many brutal attacks. Seems to be playing with his victim. 13/10 fr*ckin frightening #BarkWeek https://t.co/WpHvrQedPb,13,10,Oliver,None,25419,5524,1.3,saluki,True,0.0273507,p3,1
18,888917238123831296,2017-07-23 00:22:39,"<a href=""http://twitter.com/download/iphone"" rel=""nofollow"">Twitter for iPhone</a>",This is Jim. He found a fren. Taught him how to sit like the good boys. 12/10 for both https://t.co/chxruIOUJN,12,10,Jim,None,29232,4569,1.2,labrador_retriever,True,0.105506,p3,1
19,888804989199671297,2017-07-22 16:56:37,"<a href=""http://twitter.com/download/iphone"" rel=""nofollow"">Twitter for iPhone</a>",This is Zeke. He has a new stick. Very proud of it. Would like you to throw it for him without taking it. 13/10 would do my best https://t.co/HTQ77yNQ5K,13,10,Zeke,None,25728,4420,1.3,english_setter,True,0.0734817,p3,1
20,888554962724278272,2017-07-22 00:23:06,"<a href=""http://twitter.com/download/iphone"" rel=""nofollow"">Twitter for iPhone</a>",This is Ralphus. He's powering up. Attempting maximum borkdrive. 13/10 inspirational af https://t.co/YnYAFCTTiK,13,10,Ralphus,None,20030,3652,1.3,malamute,True,0.111411,p3,3
21,888078434458587136,2017-07-20 16:49:33,"<a href=""http://twitter.com/download/iphone"" rel=""nofollow"">Twitter for iPhone</a>",This is Gerald. He was just told he didn't get the job he interviewed for. A h*ckin injustice. 12/10 didn't want the job anyway https://t.co/DK7iDPfuRX,12,10,Gerald,None,21880,3555,1.2,bull_mastiff,True,0.000903211,p3,1
22,887705289381826560,2017-07-19 16:06:48,"<a href=""http://twitter.com/download/iphone"" rel=""nofollow"">Twitter for iPhone</a>",This is Jeffrey. He has a monopoly on the pool noodles. Currently running a 'boop for two' midweek sale. 13/10 h*ckin strategic https://t.co/PhrUk20Q64,13,10,Jeffrey,None,30346,5470,1.3,weimaraner,True,0.026236400000000003,p3,1
23,887517139158093824,2017-07-19 03:39:09,"<a href=""http://twitter.com/download/iphone"" rel=""nofollow"">Twitter for iPhone</a>",I've yet to rate a Venezuelan Hover Wiener. This is such an honor. 14/10 paw-inspiring af (IG: roxy.thedoxy) https://t.co/20VrLAA8ba,14,10,None,None,46461,11828,1.4,shopping_cart,False,0.0263208,p3,1
24,887473957103951883,2017-07-19 00:47:34,"<a href=""http://twitter.com/download/iphone"" rel=""nofollow"">Twitter for iPhone</a>",This is Canela. She attempted some fancy porch pics. They were unsuccessful. 13/10 someone help her https://t.co/cLyzpcUcMX,13,10,Canela,None,69477,18491,1.3,beagle,True,0.0389148,p3,2
25,887343217045368832,2017-07-18 16:08:03,"<a href=""http://twitter.com/download/iphone"" rel=""nofollow"">Twitter for iPhone</a>",You may not have known you needed to see this today. 13/10 please enjoy (IG: emmylouroo) https://t.co/WZqNqygEyV,13,10,None,None,33850,10547,1.3,weimaraner,True,0.134203,p3,1
26,887101392804085760,2017-07-18 00:07:08,"<a href=""http://twitter.com/download/iphone"" rel=""nofollow"">Twitter for iPhone</a>",This... is a Jubilant Antarctic House Bear. We only rate dogs. Please only send dogs. Thank you... 12/10 would suffocate in floof https://t.co/4Ad1jzJSdp,12,10,None,None,30700,6048,1.2,staffordshire_bullterrier,True,0.029704700000000007,p3,1
27,886983233522544640,2017-07-17 16:17:36,"<a href=""http://twitter.com/download/iphone"" rel=""nofollow"">Twitter for iPhone</a>",This is Maya. She's very shy. Rarely leaves her cup. 13/10 would find her an environment to thrive in https://t.co/I6oNy0CgiT,13,10,Maya,None,35363,7876,1.3,can_opener,False,0.0322529,p3,2
28,886736880519319552,2017-07-16 23:58:41,"<a href=""http://twitter.com/download/iphone"" rel=""nofollow"">Twitter for iPhone</a>","This is Mingus. He's a wonderful father to his smol pup. Confirmed 13/10, but he needs your help

https://t.co/bVi0Yr4Cff https://t.co/ISvKOSkd5b",13,10,Mingus,None,12143,3344,1.3,dandie_dinmont,True,0.08634630000000001,p3,1
29,886680336477933568,2017-07-16 20:14:00,"<a href=""http://twitter.com/download/iphone"" rel=""nofollow"">Twitter for iPhone</a>",This is Derek. He's late for a dog meeting. 13/10 pet...al to the metal https://t.co/BCoWue0abA,13,10,Derek,None,22545,4536,1.3,car_wheel,False,0.0441727,p3,1
30,886366144734445568,2017-07-15 23:25:31,"<a href=""http://twitter.com/download/iphone"" rel=""nofollow"">Twitter for iPhone</a>",This is Roscoe. Another pupper fallen victim to spontaneous tongue ejections. Get the BlepiPen immediate. 12/10 deep breaths Roscoe https://t.co/RGE08MIJox,12,10,Roscoe,pupper,21230,3231,1.2,boston_bull,True,7.55616e-05,p3,1
31,886258384151887873,2017-07-15 16:17:19,"<a href=""http://twitter.com/download/iphone"" rel=""nofollow"">Twitter for iPhone</a>",This is Waffles. His doggles are pupside down. Unsure how to fix. 13/10 someone assist Waffles https://t.co/xZDA9Qsq1O,13,10,Waffles,None,28116,6390,1.3,siamese_cat,False,0.00284892,p3,1
32,885984800019947520,2017-07-14 22:10:11,"<a href=""http://twitter.com/download/iphone"" rel=""nofollow"">Twitter for iPhone</a>",Viewer discretion advised. This is Jimbo. He will rip ur finger right h*ckin off. Other dog clearly an accessory. 12/10 pls pet with caution https://t.co/BuveP0uMF1,12,10,Jimbo,None,32888,6913,1.2,bernese_mountain_dog,True,0.00623915,p3,1
33,885528943205470208,2017-07-13 15:58:47,"<a href=""http://twitter.com/download/iphone"" rel=""nofollow"">Twitter for iPhone</a>",This is Maisey. She fell asleep mid-excavation. Happens to the best of us. 13/10 would pat noggin approvingly https://t.co/tp1kQ8i9JF,13,10,Maisey,None,36181,6531,1.3,kuvasz,True,0.134697,p3,1
34,885311592912609280,2017-07-13 01:35:06,"<a href=""http://twitter.com/download/iphone"" rel=""nofollow"">Twitter for iPhone</a>",RT @dog_rates: This is Lilly. She just parallel barked. Kindly requests a reward now. 13/10 would pet so well https://t.co/SATN4If5H5,13,10,Lilly,None,0,18835,1.3,pug,True,0.0119335,p3,1
35,885167619883638784,2017-07-12 16:03:00,"<a href=""http://twitter.com/download/iphone"" rel=""nofollow"">Twitter for iPhone</a>",Here we have a corgi undercover as a malamute. Pawbably doing important investigative work. Zero control over tongue happenings. 13/10 https://t.co/44ItaMubBf,13,10,None,None,22057,4444,1.3,eskimo_dog,True,0.0557697,p3,4
36,884925521741709313,2017-07-12 00:01:00,"<a href=""http://twitter.com/download/iphone"" rel=""nofollow"">Twitter for iPhone</a>","This is Earl. He found a hat. Nervous about what you think of it. 12/10 it's delightful, Earl https://t.co/MYJvdlNRVa",12,10,Earl,None,77975,18773,1.2,staffordshire_bullterrier,True,0.127725,p3,1
37,884876753390489601,2017-07-11 20:47:12,"<a href=""http://twitter.com/download/iphone"" rel=""nofollow"">Twitter for iPhone</a>",This is Lola. It's her first time outside. Must test the earth and taste the atmosphere. 13/10 you're doing great Lola https://t.co/74TKAUsLkO,13,10,Lola,None,28093,5930,1.3,norfolk_terrier,True,0.0373485,p3,1
38,884562892145688576,2017-07-11 00:00:02,"<a href=""http://twitter.com/download/iphone"" rel=""nofollow"">Twitter for iPhone</a>",This is Kevin. He's just so happy. 13/10 what is your secret Kevin https://t.co/1r4MFCbCX5,13,10,Kevin,None,24428,4993,1.3,brabancon_griffon,True,0.0440019,p3,1
39,884441805382717440,2017-07-10 15:58:53,"<a href=""http://twitter.com/download/iphone"" rel=""nofollow"">Twitter for iPhone</a>","I present to you, Pup in Hat. Pup in Hat is great for all occasions. Extremely versatile. Compact as h*ck. 14/10 (IG: itselizabethgales) https://t.co/vvBOcC2VdC",14,10,None,None,27136,5732,1.4,chihuahua,True,0.00208089,p3,1
40,884162670584377345,2017-07-09 21:29:42,"<a href=""http://twitter.com/download/iphone"" rel=""nofollow"">Twitter for iPhone</a>",Meet Yogi. He doesn't have any important dog meetings today he just enjoys looking his best at all times. 12/10 for dangerously dapper doggo https://t.co/YSI00BzTBZ,12,10,Yogi,doggo,20484,3037,1.2,norwegian_elkhound,True,0.0491476,p3,1
41,883838122936631299,2017-07-09 00:00:04,"<a href=""http://twitter.com/download/iphone"" rel=""nofollow"">Twitter for iPhone</a>",This is Noah. He can't believe someone made this mess. Got the vacuum out for you though. Offered to help clean pup. 12/10 super good boy https://t.co/V85xujjDDY,12,10,Noah,None,22015,3501,1.2,kelpie,True,0.0630203,p3,1
42,883482846933004288,2017-07-08 00:28:19,"<a href=""http://twitter.com/download/iphone"" rel=""nofollow"">Twitter for iPhone</a>","This is Bella. She hopes her smile made you smile. If not, she is also offering you her favorite monkey. 13.5/10 https://t.co/qjrljjt948",5,10,Bella,None,46200,10130,0.5,kuvasz,True,0.00550072,p3,1
43,883360690899218434,2017-07-07 16:22:55,"<a href=""http://twitter.com/download/iphone"" rel=""nofollow"">Twitter for iPhone</a>",Meet Grizzwald. He may be the floofiest floofer I ever did see. Lost eyes saving a schoolbus from a volcano erpuption. 13/10 heroic as h*ck https://t.co/rf661IFEYP,13,10,Grizzwald,floofer,22672,3740,1.3,newfoundland,True,0.00214033,p3,1
44,883117836046086144,2017-07-07 00:17:54,"<a href=""http://twitter.com/download/iphone"" rel=""nofollow"">Twitter for iPhone</a>","Please only send dogs. We don't rate mechanics, no matter how h*ckin good. Thank you... 13/10 would sneak a pat https://t.co/Se5fZ9wp5E",13,10,None,None,37418,6774,1.3,kuvasz,True,0.00247094,p3,2
45,882992080364220416,2017-07-06 15:58:11,"<a href=""http://twitter.com/download/iphone"" rel=""nofollow"">Twitter for iPhone</a>",This is Rusty. He wasn't ready for the first pic. Clearly puppared for the second. 13/10 confirmed great boy https://t.co/tyER0KpdXj,13,10,Rusty,None,24062,3988,1.3,dingo,False,0.07341439999999999,p3,1
46,882762694511734784,2017-07-06 00:46:41,"<a href=""http://twitter.com/download/iphone"" rel=""nofollow"">Twitter for iPhone</a>",This is Gus. He's quite the cheeky pupper. Already perfected the disinterested wink. 12/10 would let steal my girl https://t.co/D43I96SlVu,12,10,Gus,pupper,28478,4995,1.2,flat-coated_retriever,True,0.015579399999999997,p3,1
47,882627270321602560,2017-07-05 15:48:34,"<a href=""http://twitter.com/download/iphone"" rel=""nofollow"">Twitter for iPhone</a>",This is Stanley. He has his first swim lesson today. Doggle straps adjusted. Ready to go. 13/10 Phelps is nervous (IG: stanleythe_corgi) https://t.co/Nx52PGwH94,13,10,Stanley,None,28014,6183,1.3,cardigan,True,0.107699,p3,1
48,882268110199369728,2017-07-04 16:01:23,"<a href=""http://twitter.com/download/iphone"" rel=""nofollow"">Twitter for iPhone</a>",This is Alfy. You're witnessing his first watermelon experience. I think it was a success. 13/10 happy 4th Alfy ðŸ‡ºðŸ‡¸ https://t.co/fYP5RlutfA,13,10,Alfy,None,45206,11794,1.3,cocker_spaniel,True,0.0171995,p3,1
49,882045870035918850,2017-07-04 01:18:17,"<a href=""http://twitter.com/download/iphone"" rel=""nofollow"">Twitter for iPhone</a>","This is Koko. Her owner, inspired by Barney, recently built a cart for her to use during walks if she got tired. 13/10 rest easy Koko https://t.co/zeDpnsKX7w",13,10,Koko,None,29530,5060,1.3,golden_retriever,True,0.00694063,p3,1
50,881906580714921986,2017-07-03 16:04:48,"<a href=""http://twitter.com/download/iphone"" rel=""nofollow"">Twitter for iPhone</a>",This is Rey. He's a Benebop Cumberfloof. 12/10 dangerously pettable https://t.co/503CgWbhxQ,12,10,Rey,None,24412,3444,1.2,koala,False,0.12701700000000002,p3,1
51,881666595344535552,2017-07-03 00:11:11,"<a href=""http://twitter.com/download/iphone"" rel=""nofollow"">Twitter for iPhone</a>",This is Gary. He couldn't miss this puppertunity for a selfie. Flawless focusing skills. 13/10 would boop intensely https://t.co/7CSWCl8I6s,13,10,Gary,None,50835,10851,1.3,golden_retriever,True,0.16073900000000002,p3,1
52,881536004380872706,2017-07-02 15:32:16,"<a href=""http://twitter.com/download/iphone"" rel=""nofollow"">Twitter for iPhone</a>","Here is a pupper approaching maximum borkdrive. Zooming at never before seen speeds. 14/10 paw-inspiring af 
(IG: puffie_the_chow) https://t.co/ghXBIIeQZF",14,10,None,pupper,49709,16234,1.4,persian_cat,False,0.114854,p3,1
53,881268444196462592,2017-07-01 21:49:04,"<a href=""http://twitter.com/download/iphone"" rel=""nofollow"">Twitter for iPhone</a>",Meet Elliot. He's a Canadian Forrest Pup. Unusual number of antlers for a dog. Sneaky tongue slip to celebrate #Canada150. 12/10 would pet https://t.co/cgwJwowTMC,12,10,Elliot,None,23188,5230,1.2,ibex,False,0.0556607,p3,1
54,880935762899988482,2017-06-30 23:47:07,"<a href=""http://twitter.com/download/iphone"" rel=""nofollow"">Twitter for iPhone</a>",This is Louis. He's crossing. It's a big deal. 13/10 h*ckin breathtaking https://t.co/D0wb1GlKAt,13,10,Louis,None,17099,2821,1.3,traffic_light,False,0.0695338,p3,1
55,880872448815771648,2017-06-30 19:35:32,"<a href=""http://twitter.com/download/iphone"" rel=""nofollow"">Twitter for iPhone</a>",Ugh not again. We only rate dogs. Please don't send in well-dressed  floppy-tongued street penguins. Dogs only please. Thank you... 12/10 https://t.co/WiAMbTkDPf,12,10,None,None,21412,3885,1.2,chihuahua,True,0.0337257,p3,1
56,880465832366813184,2017-06-29 16:39:47,"<a href=""http://twitter.com/download/iphone"" rel=""nofollow"">Twitter for iPhone</a>",This is Bella. She had her first beach experience this morning. Complete success. 12/10 would perform a sandy boop https://t.co/4VsFysDmiw,12,10,Bella,None,28670,6384,1.2,cocker_spaniel,True,0.00937082,p3,1
57,880221127280381952,2017-06-29 00:27:25,"<a href=""http://twitter.com/download/iphone"" rel=""nofollow"">Twitter for iPhone</a>",Meet Jesse. He's a Fetty Woof. His tongue ejects without warning. A true bleptomaniac. 12/10 would snug well https://t.co/fUod0tVmvK,12,10,Jesse,None,27219,4301,1.2,clumber,True,0.0525803,p3,1
58,880095782870896641,2017-06-28 16:09:20,"<a href=""http://twitter.com/download/iphone"" rel=""nofollow"">Twitter for iPhone</a>",Please don't send in photos without dogs in them. We're not @porch_rates. Insubordinate and churlish. Pretty good porch tho 11/10 https://t.co/HauE8M3Bu4,11,10,None,None,27777,4427,1.1,beagle,True,0.106073,p3,1
59,879862464715927552,2017-06-28 00:42:13,"<a href=""http://twitter.com/download/iphone"" rel=""nofollow"">Twitter for iPhone</a>",This is Romeo. He would like to do an entrance. Requesting your immediate assistance. 13/10 https://t.co/Qh5aEkRQm9,13,10,Romeo,None,22410,3555,1.3,cocker_spaniel,True,0.00948502,p3,3
60,879492040517615616,2017-06-27 00:10:17,"<a href=""http://twitter.com/download/iphone"" rel=""nofollow"">Twitter for iPhone</a>",This is Bailey. He thinks you should measure ear length for signs of growth instead. 12/10 https://t.co/IxM9IMKQq8,12,10,Bailey,None,23528,3239,1.2,bath_towel,False,0.0733202,p3,1
61,879415818425184262,2017-06-26 19:07:24,"<a href=""http://twitter.com/download/iphone"" rel=""nofollow"">Twitter for iPhone</a>",This is Duddles. He did an attempt. 13/10 someone help him (vid by Georgia Felici) https://t.co/UDT7ZkcTgY,13,10,Duddles,None,106489,44895,1.3,cardigan,True,0.110481,p3,1
62,879376492567855104,2017-06-26 16:31:08,"<a href=""http://twitter.com/download/iphone"" rel=""nofollow"">Twitter for iPhone</a>",This is Jack AKA Stephen Furry. You're not scoring on him. Unless he slips down the slide. 12/10 would happily get blocked by https://t.co/0gOi601EAa,12,10,Jack,None,16862,3165,1.2,pembroke,True,0.0188266,p3,1
63,879050749262655488,2017-06-25 18:56:45,"<a href=""http://twitter.com/download/iphone"" rel=""nofollow"">Twitter for iPhone</a>",This is Steven. He has trouble relating to other dogs. Quite shy. Neck longer than average. Tropical probably. 11/10 would still pet https://t.co/2mJCDEJWdD,11,10,Steven,None,22717,4799,1.1,egyptian_cat,False,0.132932,p3,1
64,879008229531029506,2017-06-25 16:07:47,"<a href=""http://twitter.com/download/iphone"" rel=""nofollow"">Twitter for iPhone</a>",This is Beau. That is Beau's balloon. He takes it everywhere. 13/10 would protect at all costs https://t.co/YDtpCjIPKN,13,10,Beau,None,19050,2738,1.3,american_staffordshire_terrier,True,0.0087113,p3,1
65,878776093423087618,2017-06-25 00:45:22,"<a href=""http://twitter.com/download/iphone"" rel=""nofollow"">Twitter for iPhone</a>",This is Snoopy. He's a proud #PrideMonthPuppo. Impeccable handwriting for not having thumbs. 13/10 would love back #PrideMonth https://t.co/lNZwgNO4gS,13,10,Snoopy,puppo,19481,4198,1.3,ibizan_hound,True,0.0397246,p3,2
66,878281511006478336,2017-06-23 16:00:04,"<a href=""http://twitter.com/download/iphone"" rel=""nofollow"">Twitter for iPhone</a>","Meet Shadow. In an attempt to reach maximum zooming borkdrive, he tore his ACL. Still 13/10 tho. Help him out below

https://t.co/245xJJElsY https://t.co/lUiQH219v6",13,10,Shadow,None,7804,1315,1.3,appenzeller,True,0.12850699999999998,p3,1
67,878057613040115712,2017-06-23 01:10:23,"<a href=""http://twitter.com/download/iphone"" rel=""nofollow"">Twitter for iPhone</a>",This is Emmy. She was adopted today. Massive round of pupplause for Emmy and her new family. 14/10 for all involved https://t.co/cwtWnHMVpe,14,10,Emmy,None,42285,6971,1.4,toy_terrier,True,0.0152434,p3,1
68,877736472329191424,2017-06-22 03:54:17,"<a href=""http://twitter.com/download/iphone"" rel=""nofollow"">Twitter for iPhone</a>",This is Aja. She was just told she's a good dog. Suspicions confirmed. 13/10 would tell again https://t.co/lsPyyAiF1r,13,10,Aja,None,80474,19526,1.3,weimaraner,True,0.0405991,p3,2
69,877611172832227328,2017-06-21 19:36:23,"<a href=""http://twitter.com/download/iphone"" rel=""nofollow"">Twitter for iPhone</a>",RT @rachel2195: @dog_rates the boyfriend and his soaking wet pupper h*cking love his new hat 14/10 https://t.co/dJx4Gzc50G,14,10,None,pupper,0,81,1.4,irish_terrier,True,0.107473,p3,1
70,877556246731214848,2017-06-21 15:58:08,"<a href=""http://twitter.com/download/iphone"" rel=""nofollow"">Twitter for iPhone</a>",This is Penny. She's both pupset and fired pup. Not pleased w your barbaric attempts at cleanliness. 12/10 would enjoy more shampoo options https://t.co/OYdDlfOGXP,12,10,Penny,None,22915,3899,1.2,bathtub,False,0.000467919,p3,1
71,877316821321428993,2017-06-21 00:06:44,"<a href=""http://twitter.com/download/iphone"" rel=""nofollow"">Twitter for iPhone</a>","Meet Dante. At first he wasn't a fan of his new raincoat, then he saw his reflection. H*ckin handsome. 13/10 for water resistant good boy https://t.co/SHRTIo5pxc",13,10,Dante,None,27509,5279,1.3,golden_retriever,True,0.0794058,p3,1
72,877201837425926144,2017-06-20 16:29:50,"<a href=""http://twitter.com/download/iphone"" rel=""nofollow"">Twitter for iPhone</a>",This is Nelly. He graduated with his dogtorate today. Wants to know if you're proud of him. 12/10 would give congratulatory boop https://t.co/4g4cfj3P4Y,12,10,Nelly,None,27289,5706,1.2,basenji,True,8.17379e-05,p3,1
73,876838120628539392,2017-06-19 16:24:33,"<a href=""http://twitter.com/download/iphone"" rel=""nofollow"">Twitter for iPhone</a>",This is Ginger. She's having a ruff Monday. Too many pupper things going on. H*ckin exhausting. 12/10 would snug passionately https://t.co/j211oCDRs6,12,10,Ginger,pupper,20810,3429,1.2,tibetan_mastiff,True,0.08893480000000001,p3,1
74,876484053909872640,2017-06-18 16:57:37,"<a href=""http://twitter.com/download/iphone"" rel=""nofollow"">Twitter for iPhone</a>",This is Benedict. He wants to thank you for this delightful urban walk. Hopes you know he loves you. 13/10 super duper good boy https://t.co/26BXueUgbs,13,10,Benedict,None,18888,2452,1.3,chow,True,0.016723599999999998,p3,1
75,876120275196170240,2017-06-17 16:52:05,"<a href=""http://twitter.com/download/iphone"" rel=""nofollow"">Twitter for iPhone</a>","Meet Venti, a seemingly caffeinated puppoccino. She was just informed the weekend would include walks, pats and scritches. 13/10 much excite https://t.co/ejExJFq3ek",13,10,Venti,None,28085,4787,1.3,greater_swiss_mountain_dog,True,0.0949327,p3,1
